NewsId,Comment,Sen,Con,lat,long
565,"Nahid Kakku, your house? If you can come to the dhaira from home, you will not give money. After holding it, I did not lease Keonba.",pos,1,24.79974252,90.34180917
565,What will happen is that the minister fails to stop leakage of second-class questions in the country with this education,neg,1,24.47347225,91.61486039
565,"If you give the money from the official kosagara or give it to your pocket, then you are happy to give the post to the post.",pos,1,24.2564561,89.38947814
565,Submit the resignation petition?,neg,1,25.0799734,90.70616086
565,"I am leaking the question. I myself surrendered myself. Earlier, I gave five lakh rupees to me.",neg,1,25.36651185,89.67954526
565,What will happen if everybody converts him!,neg,1,23.50203199,90.16211736
565,Haha,neg,1,22.54955691,90.59558681
565,You accept the responsibility of failure and resign yourself five lakhs !!!,neg,1,25.85017377,89.3172244
565,Before giving the prize then I will give it a promise,neg,0,24.77868182,90.23752879
565,??+??+??-??=?,neg,1,23.25424661,89.89919009
565,It can not be a word! And these words are very incompatible,neg,1,23.64643439,90.39244403
565,Q: What do you do when your son-in-law Imran is involved in the fraud?,neg,1,23.83919696,91.64458072
565,"We (Bangladeshis) live in Booker State as well as a great chela, our Education Minister has not even been able to prove the question paper leak in 9 years. Should not resign, the minister should resign. The easiest way to prevent this question paper leaked is by the hand of three people. 1. Education Minister 2. Print Manager. And 3 Jail Prasasaka. Education Minister If you are not in a position to tell the manager of the printer and to the jail prasan, you are responsible for the QP leak. And every one of the students will take half an hour before the QP will be accountable if the leak is still from the office of Melpuszas. See if the QP leak will stop forever. 5,00,000 will be given from your own pocket or the public money. Ignore talking like booker. Talk like a minister's minister.",pos,0,23.36760897,90.07914682
565,"If you take advance 200 Taka After taking the money after taking the money 500 rupees and the photocopy of the admit card. If you agree, will you get reply?
Do not listen to anyone",neg,1,22.48961679,91.50310951
565,Cancellation of 2nd test of Bangla,neg,1,25.17667063,90.35942617
565,Education Minister resigns.,neg,1,25.20750635,90.01936461
565,"Emraan H. Sarker, the grandson of your daughter's son-in-law, Razakar. If you take him to remand, all will come out.",neg,1,22.03808678,90.01131765
565,"He is doing tray, not to be caught by himself!",neg,1,22.76445337,89.63734189
565,Fuck u mother toast,pos,0,22.57458989,91.34318753
565,"Hawer pola tor maiyar jamaito boro chor ,,,,,",neg,1,23.49237004,91.6530178
565,apnara snow honey or something ????,neg,1,22.47754809,89.10303518
565,Do not get the money from your treasury from the state treasury ???,neg,1,25.53535002,89.40160605
565,"Sir, this 5 lakh taka from his pocket or from government fund !!!!",neg,1,25.0532369,90.04690095
565,People around you,neg,1,25.39308855,89.22480807
565,(Mohammad Masum Rahman) handed the question to the jamender. Give five lakhs.,neg,1,22.90932358,91.89296911
565,5 lakh rupees will not cut vat + it?,neg,1,25.41707801,91.31179538
565,If you stand in front of the mirror 5 lakh taka - you will find yourself takalu ...,pos,0,23.41639155,90.50293905
565,Someone put the minister to the minister. : P,neg,1,25.97336294,90.9807464
565,False Sentiment.,neg,1,24.67498122,91.82923511
565,Seasonal ghosts,neg,1,22.05475725,91.18972623
565,Takku remanded you all can be known.,neg,1,23.91819568,89.94753324
565,Bal Falai did not have 5 million days,neg,1,24.39693347,91.63828588
565,"Complete your 'first check' test, then press again.",neg,1,25.2222197,91.44455427
565,Abal ????????,neg,1,23.363338,89.75721231
565,What would have been the announcement earlier?,neg,1,24.04130991,90.21798398
565,Illegal work by illegal means.,pos,0,25.33043858,91.22575744
565,If I catch you with proof? Five hundred thousand pub? Or will it be lost? ??,neg,1,24.36205751,89.88327741
565,Ha ha education minister should resign,neg,1,23.5551794,91.28883932
565,The money will come true,pos,1,24.3273135,89.39611123
565,"He is the brother of failure, and he resigns.",neg,1,22.49802397,89.18676186
565,Hicha Marie is a big thief on your forehead,neg,1,25.98629452,89.86381115
565,You never punished any one so far .,neg,1,23.56960158,89.54477852
565,"What is our education minister here?
He's calling me in Merckel,",neg,1,25.66001972,90.11330245
565,u ??????,pos,0,25.86998621,90.62510225
565,Athar ke dora jaba ........,neg,1,22.41426659,91.27838449
565,God has not given you shyness in your life!,neg,1,25.90482752,90.72912747
565,"Anyone who says that the specimen leaks, say, it is the country of the royal king. 57% quota again. In any argument brother ??",neg,1,23.80508434,90.70016727
565,They can not work well any day?,pos,1,23.32778662,89.01887867
565,What is your job?,neg,1,23.54161886,89.62066131
565,"You started the drama like laughing King Gopal Vaishya, the crazy goat's party.",neg,1,22.90222582,89.42824076
565,Grandfather is talking a lot about stealing # Rice ??,neg,1,25.37525766,91.17858231
565,Why does education minister resign?,neg,1,22.69898438,91.87828198
565,Who are those who love love in this post?,pos,1,23.85300032,90.36647939
565,on the other hand,neg,1,24.26452132,89.50394457
565,"Then, what are your profits from the charge, put the public on the question.",pos,0,24.94490461,91.62501085
565,"Kaku has been a lot, but now resigns please",neg,1,22.42238636,89.96340419
565,I do not want to see you,neg,1,25.41992849,91.93971565
565,ay sala montri tui fas korso tore dhorti hobe age,neg,1,23.97920709,90.60068058
565,I will laugh now or cry!,neg,1,24.60372759,91.47081742
565,"The big trick, the question papers leaked out to the outside people?",neg,1,24.70271563,89.22551031
565,Education development fund,neg,1,22.69831839,91.74002953
565,Okay now,neg,1,23.82996022,91.14357154
565,Do not think Tennon's money is .......,neg,1,25.61124592,90.89784487
565,Where do you get this money? Feel comfortably received.,neg,1,22.39950506,89.72922716
565,You are Bal Palo Kao ....,neg,1,23.71116043,91.56984476
565,Then you resign.,neg,1,23.85146023,89.53196648
565,Very good.,pos,1,25.163969,91.29975814
565,Cancel the test before! The mercenaries are being destroyed!,neg,1,25.09580926,89.97039192
565,Amader's statement can be verified in Hobby?,neg,1,22.13698928,91.83429803
565,Take five lakhs of you too ...,neg,1,23.98410546,91.31337608
565,You need your money to get the culprits and punish them.,neg,1,22.67895762,90.93472406
565,You must resign now,neg,1,23.15859242,91.44798292
565,,,,22.50983403,90.08555213
565,You do not like me at all.,neg,1,25.39392584,89.72386674
565,"Keeping the money on himself and the police caught him, Mr. Sir.",neg,1,24.5395922,89.8098571
565,All Problem Aviately Solvedi Cookie gave me the yes you were resigned,neg,1,23.73622317,90.03385268
565,"NAHID  TUMI  TU   MAIN LEADER ,  TUMAKE  DOREYA DILAM,",neg,1,23.10671444,89.41834632
565,r akta income er source ??,neg,1,24.34099482,91.00296338
565,"If you step down
You get five lakh rupees ...",neg,1,24.20783665,90.98609341
565,Porikka but diayte hobe,neg,1,23.17170316,91.83543783
565,"You are the thief, you are all thieves",neg,1,25.92489276,90.89492287
565,There is no need to be so rich.,pos,1,23.89103605,91.34847312
565,"Your resignation is enough for you. Because you failed Without showing the greed of money, ,,,,,,,,,,,,,,,",neg,1,24.25615337,89.31801612
565,Tumar nana rayyapriya dev kaloo!,neg,1,24.37380125,91.28936587
565,"Nahid Y Question Out Courses
Give 5 lakh pesco",neg,1,24.95386206,90.59971567
565,Round trip,neg,1,25.84712302,91.23446112
565,I know that no one has made a peculiar Kaku (now I give him five lakh rupees),pos,1,22.38154893,90.79820326
565,You come in front of the media with no face.,pos,0,23.25320112,89.01877087
565,Answer the question with the free questions of the children of the big cats :-D :-D :-D,neg,1,23.97704308,89.41310939
565,This is nothing short of shopping.,neg,1,23.11683537,90.13560444
565,"500,000 TAKA DAW",neg,1,23.86982169,90.22622098
565,"You hold the council, the people will give you the rewards ...",pos,1,23.61462639,89.00988008
565,"""Shamelessness and development happened",neg,1,25.87718368,89.34360116
565,Give him four and no one does not pay o mad.,neg,0,22.80945783,91.56631435
565,"You have to resign Maggie's puck, bearded baby",neg,1,23.31997993,89.31780415
565,Nahid gave me the madness to give you 5000 rupees a day !!,pos,1,23.48136596,91.14841786
565,"If we used to argue, why do you keep the guards like a cushion, and then we worry",neg,1,23.24782312,90.8328274
565,There is nothing left to hate me in this verse ....,neg,1,25.27859327,91.70126708
565,"Sir,
How much more
Say the truth to the people.",neg,1,22.79399251,90.31394548
565,tumble,neg,1,25.09678876,90.66672584
565,Darun offer,neg,1,22.04980803,91.79354434
565,Let the Education Minister be given a bouquet.,neg,1,22.11005141,89.55122674
565,If my wife is able to get paralyzed with five lakhs,pos,1,23.45532194,89.13588756
565,Porsche packed food containers?,pos,1,22.62752529,89.2223118
565,Took money on the tree,neg,1,25.47395116,91.54497675
565,Baler minister,neg,1,25.17369534,90.95870664
565,Then you will get,neg,1,25.99355496,91.29663354
565,Do not go without any hitchhikt,neg,1,25.13813364,90.09351797
565,"The thieves are the masked brothers.
Thieves do not listen to the story of religion .. Reciprocity",neg,1,25.3400044,90.99656423
565,Are you the leader to create a minister for the post?,neg,1,24.24939641,91.53876244
565,You make a man's bald.,neg,1,25.62404572,89.84418571
565,press he lok dher k regine dan ... plz,neg,1,23.29530532,89.02299098
565,What happens if the chickens are kept near the fox,neg,1,23.54210527,91.99303682
565,Imran H Sarkar!,neg,1,25.30119835,91.15312985
565,You are crazy,neg,1,22.36531784,89.55828776
565,I have evidence but where will I get the money ???,neg,1,23.5191168,89.51980804
565,## Finally Kakku admitted .....,neg,0,24.64696385,89.75310666
565,"Salah is the number one broker
Indian Brokers",neg,1,25.85802707,89.25345996
565,Kaku 1 song?,pos,1,24.26201533,89.94342728
565,"The corners of your own chorus, the face of the ocean at Borka Bor Dao Fol 00000. Mantarto Sara Dan",neg,1,22.64146279,89.82327607
565,Eta apnar berthota apni keno podothag korchen by Mr behaya montri,neg,1,25.44913799,89.57410786
565,Attempts to cover fish with spinach,neg,1,23.99603938,89.29764013
565,# Journalist !!,neg,1,25.07278475,90.04303615
565,This is the government's name forged by copying everyone,neg,1,23.650056,91.19746505
565,This is the question that they take the prize,neg,1,22.62829359,89.2792499
565,Madheeri Nahid.,neg,1,23.04049114,91.26576276
565,A thief caught another thief again,neg,1,23.14703378,91.38249362
565,"5 lakhs of money, you will say that you will step down and everyone will see it",neg,1,22.06555072,89.01174597
565,"Mr. will hand over the public, why do you do it",neg,1,24.33502169,89.66161913
565,Pagole koy ki .......?,neg,1,24.65187986,90.64195599
565,exam batil kora hok,neg,1,24.9771798,91.50055617
565,"The question is, how do I fuck me ????",neg,1,23.66114956,90.08307116
565,People despair listen to you.,neg,1,24.01169542,91.86589003
565,"What will your father do to the money Do not be shy, you should leave your cabinet.",neg,1,23.94266533,91.86508612
565,Thief,neg,1,25.52761672,91.39173785
565,?? This situation is for today's failed people like you.,neg,1,24.9617238,89.73225659
565,The question will be leaked why you will pay or why.,neg,1,22.85331578,89.87828151
565,Mama will appoint them in a big post?,neg,1,25.39785602,89.20419916
565,What is the spindle mama?,pos,1,22.63048721,89.31032319
565,It's a different way to fail,pos,1,25.32236372,91.67844461
565,Employed Minister,neg,1,25.47945911,91.38293183
565,The strict rules of the government are very important.,pos,1,23.32206573,89.56372468
565,Imran Aids Noisy Yours?,neg,1,25.16548084,89.29601488
565,Kano you did not recognize it is your golden kid goat league,neg,0,23.50342384,89.00490833
565,Getting Started ...,neg,1,25.20519362,89.17910061
565,R Aponak is around koto. ????????????,neg,1,25.87417937,89.69848866
565,"Minister thief ..?
And do not need to show greed ...?",neg,1,25.9812045,91.39445474
565,Thief's big throat,neg,1,25.37316744,91.50941957
565,Rowdy Mantri,neg,1,22.94119787,90.02989008
565,How many people?,neg,1,24.04915968,90.25842237
565,The administration did not kill mosquitoes.,neg,1,25.78850968,90.44334597
565,Now will be fun,pos,1,22.36465556,89.09681931
565,mine. Gave 5 bribe,neg,1,22.91885838,91.245986
565,I'm going to go to his house and he's going to go to the club,neg,1,23.93960786,91.48274445
565,You are enough to destroy the education system of a country.,pos,0,25.90088986,90.35523002
565,imran h sarkar.,neg,1,23.46130771,90.16644369
565,bangladesh ar poalis b n p ta basto naki,neg,1,24.55911049,91.11041706
565,"If you ask questions, who will tell someone?",neg,1,24.27636276,90.44007199
565,Your wife,neg,1,24.4969433,91.21691154
565,Pagol,neg,1,24.7960582,89.98075685
565,I know who thief! Nahid thief !! Nahid thief !!!,neg,1,24.3237183,89.55936469
565,Sleep now.,neg,1,23.51304536,91.51390774
565,The question lies in your cooperation,neg,1,23.109141,91.02532302
565,Is this your digital era?,neg,0,22.19185647,90.84374968
565,But the word Deba,neg,1,25.92200518,91.83107285
565,Shanto you know who ??,neg,1,24.68483439,91.48756765
565,Thu,neg,1,22.33162089,90.93415599
565,Foul,neg,1,23.70551692,91.17205693
565,What can be done with Fazle Rabbi 5 lakh?,neg,1,23.33621664,91.69244024
565,Nice,neg,1,24.35083567,89.40116763
565,Wish your neighborhood and win 5 goals yourself.,neg,1,25.70802007,91.28317423
565,ball,neg,1,22.84393498,89.34945071
565,"Yes, hah, americans",neg,1,22.44331073,90.51079103
565,There is no one to catch you,neg,1,22.86650301,91.00425327
565,Appni Ojuggo.apnar podotteg kora uchit,neg,1,25.27240727,89.02873915
565,,,,22.653093,91.16787907
565,It is necessary to investigate the amount of money Taklu Sahib gets every year for question papers,pos,1,25.07712353,90.89641076
565,Kaku you are such a big ass! Somebody is remanded by police and it is BNP's job,neg,1,25.84401077,91.41555658
565,You do not need money to leak the question leak,neg,1,25.87227454,89.56073018
565,"My mother, Jani Tamer, was born around him",neg,1,25.91417574,89.83376024
565,What do you think about this?,neg,1,23.43988934,91.16817171
565,Cut trees at the beginning of the tree if the tree live?,pos,0,24.60130119,91.70800108
565,And the prize you please resigns ....,neg,1,24.93224839,89.22614549
565,You should also resign for the liability of charging.,neg,1,24.62670396,91.00312574
565,Take care of Mamu's digital camera,neg,0,22.27941385,91.33028754
565,They want to do all in exchange for money but do not want to work,neg,1,24.66453836,90.85792043
565,You will be given 500 taka on your tar,neg,1,23.49513555,89.41617278
565,What a ridiculous decision that the minister is absolutely indescribable!,neg,1,22.94624722,91.8291654
565,"Give the Nobel Prize to Nahid, that's worthy.",pos,1,25.35610858,90.58709571
565,sorser modhhey vot,neg,1,25.41856509,89.81849408
565,Roopak Tuito Arresat hobir,neg,1,23.60821073,91.03694618
565,Five lakh rupees to gain from other people?,neg,1,25.13950004,89.94751314
565,What will the people do Where is the administration,neg,1,25.69488253,91.2179302
565,What is this Ghoshura?,neg,1,24.74107275,90.27549818
565,5 million bribe money?,neg,1,24.22787329,90.99771441
565,How much money do you give up?,neg,1,23.68885442,90.62034266
565,The people of Bangladesh do not respect you.,neg,1,24.54670919,90.13471968
565,"If I want to hand over the education minister to the question leaks, then I will be given a million rupees prize ??? The question to the nation is :-)",neg,1,22.21427522,90.03950779
565,"Bata Fanni's baby phoenician .....
Questions have been leaked to millions of rupees and none of your five lakhs
Pale ??? ??",neg,1,22.79494952,90.9163991
565,This is how the thief itself has given itself a reward.,neg,1,24.94660642,91.1382482
565,"Honorable Nahid brother
If you step down, then all the arrangements will be made. Please resign, ,,,, if you resign then the country will live, the future generation of the country will live. Please resign, please ,,,,,,",neg,1,22.36322536,90.77905986
565,"Honorable Minister of Education
Drink water from the former minister Milon Sahib. He was a successful minister.
ˇˇˇˇˇˇˇˇˇMany people will say some more today.",neg,1,23.56919248,89.50368427
565,"Not long ago, the question has not yet been leaked. Then again, the award was announced.

You are the son of your daughter, the father of your daughter.",neg,1,25.43301272,90.63910606
565,It is important to get news of the declaration of resignation without declaring the prize ...,neg,0,22.06379028,90.36257154
565,"One of the questions asked me by making Jiganta powder by ............ ????????????
Now ten million ??",neg,1,25.79620089,91.4151255
565,"Umm Jani cut as Fez chair, Nural Islam Nam Nam Ak Takla cut Fez district Great, you deserve the price of Shi, a matter of energy Shi",neg,1,24.42809503,90.76420809
565,"Maiya masha masakara ,,,, if they ask about 5 crore taka if you ask them, and you say that if you give them, you will give five lakh rupees. Anyone you want to kill the golden egg paws?",neg,0,22.28021015,89.98463688
565,"Matin Bhai, I went to the house of Milon, but I did not know the way to his house.
So take my hand and take him to his brother.",neg,1,24.16576309,90.50810435
565,"attention please :)

ˇGive the person who is known as Kakku in Bangladesh: /
Only he knows how the question is leaked o.O>: O",neg,1,24.37483609,90.5253965
565,"If a nation or country is to fall, it is the first to fall in its talent. Which is going on in our country. One garlic of all garlic. Is it not proved by the announcement of the prize that the officials of the ministry or all the people fail to work in their work. Questioned to the nation? If they had not failed, I would not have needed to repel corruption through the prize. And in the manner in which the information technology law was introduced in the country without taking into account the importance of public opinion, it has become impossible for me to express my right to freedom of opinion and independence. Because the law is currently only recorded in the constitution or in the script of the book. It has not been noticed at the busy time. In which case the high level people of the society are not getting the right judgment, then we can hope for the common man to get justice. So finally I want to say that the first condition of the power sector is accountability or public opinion and public welfare.",neg,1,23.89967517,89.7007038
565,"I'll give you that.
His name is Nahid Taclu.
Jamai Imran Taclu
Team Taclu League",pos,1,24.86306852,91.73906008
565,The Sonar boys are making money in the coat from the shadow of the education minister and the minister will award only 5 lakh rupees.,neg,1,23.86172439,90.55919182
565,I'll pay 5 million taka to the thieves with 1 million taka? So today we started searching for a trained thief ???? >>>>>,neg,1,22.94264725,89.32858035
565,?? Second heading was an epic.,pos,1,23.33478866,91.05928522
565,"From now on, the department / board-based question was launched which was in progress.
If a board question is leaked about 80% of the board chairman and the rest
ˇ20% will be the highest individual.",neg,1,23.36538226,90.6195657
565,"If the education minister challenges that question, he will resign, then it may be possible to stop the question. There will be nothing inadvertent..It will continue.",pos,0,25.96793314,91.30231162
565,"There is no price for your words. Now all of your lies are fake, baseless. You fail because you can not take a fair trial test. This government can say a lot in the face, but the work is the opposite of all. What will I say these corrupt !!!!",neg,1,23.45172207,91.65738392
565,Sajjad Muhammad Saifullah is involved in Messi. This time I gave my million,neg,1,23.90995282,91.85397941
565,If the question is leaked then it is better for those students who are bad students in the study. It is better to see them in this direction.,neg,1,23.8959941,89.80445614
565,bustard of the year.,neg,1,22.04047071,91.38544537
565,Cancellation of exam for leaked question.,neg,1,25.08849048,89.47652239
565,If the question is 10 lakh students will give it,pos,1,24.7257889,89.74465939
565,Ghorer bow jodi porokia korea tahole couple condom is dokan bondo korea make ki ????? N,pos,1,24.01295692,89.62720349
565,Nahid Kakkur's heart wants to satisfy my thirst.,neg,1,23.14054083,89.94813813
565,"After some time, Kaku will say that if he is examined on the leaked question, he will pay a fine of Tk 5 lakh",pos,1,22.57035363,90.00910175
565,"There is a man who took my pen, who ray you",pos,1,25.33883659,91.50843183
565,There is no other than a minister of education.,neg,1,25.36840536,90.39657533
565,"The consciousness of two people, the nation is pregnant today ??????",neg,1,25.9030131,90.82397498
565,"* Qualifying the leakage of Tk 5 lakhs if the government is able to get rid of the leaks. Education Minister.
...",pos,1,22.43672922,90.02704524
565,I will not have the smell and hold on.,neg,1,22.21805614,89.44566171
565,"Guaya khabo kadaya
You hit the armies
Then you will have so much entertainment",neg,1,25.41879914,91.29194034
565,You just get the prize ... Can not do anything to do the job,neg,1,22.8488849,89.50923267
565,5 lakh!!??????,neg,1,23.29270577,90.02635597
565,Stand up. Give it,neg,1,22.02587598,91.68154523
565,Nurul takla the ultimate criminal ??,pos,1,22.12885357,91.10479681
565,People will not be tempted by greed: p: p,neg,1,24.45681579,91.94489025
565,Budai,neg,1,22.74341688,90.22309566
565,Take turns 8-),neg,1,23.79953769,90.76764763
565,The country wants to know the country came from,neg,1,24.64747959,90.19487753
565,No one except Nahid Takla ..,neg,1,24.34271328,90.17537903
565,wow????,neg,1,25.42516674,91.45733051
566,Head wasted,neg,1,24.06824457,89.91149915
566,This salai only takes business with question papers. It has declared itself a prize.,neg,1,22.12178974,89.94077785
566,Education Minister resigns,neg,1,23.99022955,90.21457683
566,Education Minister !!?,neg,1,24.39153595,90.9147242
566,How are you doing?,neg,1,25.0855204,90.41214504
566,Want corruption and coaching free education?,neg,1,25.83960823,91.67589095
566,Then he is agreeing to the rate,neg,1,23.14290155,91.35912018
566,My dem as a lakve is sick,neg,1,23.29659826,89.80389529
566,Ballll ... ??????,neg,1,22.07536162,90.09825196
566,This Nahid talks about the man in the taste.,neg,1,23.0840205,90.48772665
566,Great entertainment,neg,1,24.80725532,91.82885886
566,5 core language komu,neg,1,25.24827525,90.36385156
566,champion,neg,1,22.71614984,89.17957327
566,Education Minister resigns 10 lakh,neg,1,23.12826026,90.82765604
566,Cheating bout,neg,1,23.17631579,90.10594453
566,"If you want to do Nahid Kaku, then you will survive our Bangladesh, so you can post it",neg,1,22.39415117,91.44826775
566,Jahidul Islam Shimul Do not miss the opportunity: -p,neg,1,23.80835004,90.19199617
566,T,neg,1,23.77294201,91.77352385
566,OMG,neg,1,25.82523048,90.65407719
566,Ok,neg,1,23.45701389,89.63067273
566,T,neg,1,25.62824123,89.70226459
566,ok,neg,1,24.6447127,90.96095414
566,ok,neg,1,24.89561743,91.54204097
566,,,,23.99899435,91.92560895
566,It does not,neg,1,25.39991767,91.62325253
566,There is no law in the country.,neg,1,24.42356433,90.8603419
566,Number koi. Jogajok basket kivabe,neg,1,24.88195048,91.67272871
566,See waye Ahmed nayam,neg,1,25.90945345,90.94631506
566,Tinker ring,neg,1,23.74727802,90.310707
566,Rofiqul Islam Rajib Ahmed,neg,1,24.98989786,91.74518032
566,"The cost of the job is 12/16 lac. In Kennethabel, it takes 16 lacs from ASI. Then why they will not be hijacked. It is their right.",pos,0,23.15354669,90.77521215
566,It is the rule of the country that highway robbery by traffic sergeant night at noon,neg,1,23.70352651,89.5251395
566,Win bangla,neg,1,24.04486164,91.41009416
566,That's right .....,pos,0,24.93459201,89.02565414
566,??????,neg,1,22.9754478,90.05658667
566,T,neg,1,24.60371837,90.08478087
566,Then who will believe in people,neg,1,23.63576128,90.86286273
566,Sek Hassinar Digital Bangladesh,neg,1,24.06096675,89.07717004
566,That's a fruitful idea maybe.,pos,1,23.06115948,89.25184764
566,"Our dependence on foreign countries is increasing day by day, and why we do not neglect our responsibility.",neg,1,23.20956945,89.69552879
566,Bornchora himself smuggled money. Recruit people to retain the money again.,neg,1,23.44535035,89.29780114
566,There are no people in the country. It's all money to eat money.,neg,1,23.97802823,89.13791
566,??,neg,1,25.79984629,91.27944495
566,ok,neg,1,25.68903457,91.63584755
566,"With foreign assignments, send some more money abroad.",neg,0,23.76708138,89.58953416
566,ok,neg,1,23.72891795,91.47952428
566,"It is not possible to recover money, the money of the foreign country is filled with pockets of foreign brokers",pos,1,22.95714612,89.09313698
566,"Thank you very much to Little Master (Mominul), he would have lost his innings and runs in the match.",neg,1,23.65725759,89.05696818
566,"Draupa is a great achievement for us thanks to Liton and not to speak of Mominul again, he is a master in Test Arena",pos,1,22.41749049,89.27407022
