NewsId,Comment,Sen,Con,lat,long
32,"Vai liton borabor e valo knife game for free ... something like something with ...
O hoto duck out out oita nia ninduk ra ektu besi boila felse .... Vai ...
100 korle ...
Download thakben ...
Ar duck has out hoila gali diben ...
Aita kmn hoia gelo with ...
No desh dining ...
Harleo ai player gulo diner jitleo hour .....
Ar haar jit thakbai vai ....
Akbar vaabsen ...
Goto koek bosor age Bangladesh jitto bosor 2 / 1ta match ...
Ar akn shob match and pray jita ....
What do you think?",neg,1,22.01407903,91.99424093
32,"It's the contribution of Ghazan Sujon, the bull Lord Liton Dash may have faded a lot!",neg,1,25.9339758,90.81481845
32,"Liton is playing for the national team for two years. This is the first time he has given something to the team, which is to be remembered. Now he does not have to send oil to the planet and send it to Mars. Write some for this continuity.",pos,0,25.32209088,90.32225972
32,"In the first innings of a single innings, Sir Alfred Liton gave a legend to Kumar Das! However, this innings of the Sir convincing the next 10 matches!",neg,1,25.05499173,89.005125
32,"An innings that did not have to be seen to show the dancers was needed for his career, otherwise he would have gone to the dustbin in the next match.",neg,1,22.42649289,91.86763325
32,"Liton hero became an actor in an innings, and when he made villains, they know it. By the way the innings were very timely and effective. So thanks Liton Das Carry on.",pos,1,24.43850821,89.85524778
32,What will the repressors reply? He can not find his own existence. 36 years in the test once 90+ the whole time? How many Sri Lankan batsmen have scored hundreds and half centuries in this field? Liton should not be an international match.,neg,1,22.16077764,90.08098979
32,Tapaah dada khan ai aan gan gun tho aur desh ... bolen apni bujen ke lalon dash ki aamon ke liye ke liye ke liye ke liye ji nea apni aur gola bana korsen .... shudu koar nahin johota thokok r na thakok ... aber gola baji korben ..... ai hoilo apnra,neg,1,22.0387489,91.30745829
32,Liton congratulations. But there is no reason to be so excited. The performance is praised on the batting pitch but not too big. She has to be consistent. I wish him success.,neg,1,23.47168188,89.48492238
32,"If you do not play well, it will not be good to play 50 matches in one match. If you can play such a bud, then I will be able to play my 8th birthday and 50. This is not something unusual .... How big is he (player) ... He should prove that he is waiting for a player ....",pos,1,24.61237091,91.44159685
32,"Miraz has been given an orange flat in the game.
I demand the emphasis,
Liton will have to pay flats this time.
My appeal to the nation is about this.",pos,1,24.24395919,90.33403355
32,"Liton's supporters are skipping around from the pit of a lion, because Liton is playing well ... talk to them for a while, ready to go into the hole, do not skip. There is no confirmation when he plays well. The words are bad but it is real ... Because we saw Liton game so long ...",neg,1,25.89303823,90.19828747
32,"How many matches did he have to play well?
ˇIf you get so much opportunity, others play better.",neg,1,24.63138141,91.39971663
32,"If a plain boy in the field of our village gives 20 match time, he will not be happy with one match.",pos,1,24.32203452,91.47835233
32,"There is also a hundred of Abul Hasan of Bangladesh playing a match well so there is nothing to jump!
Liton's name has not yet been added to the Century!
Insha Allah will be in four or five years.
May be the national team elephants with the ability to pray.",pos,0,22.34685532,90.03553434
32,"The salaried journalist of Salar Bangla, who thinks he is playing a match well, that is the amount of money they take. If they do not play well, why do they need to keep them in the team?",neg,1,22.12575835,89.49137241
32,"Do not play well, I can not say it well today. I do not want to keep it consistently. If you can not change the rules, no one is outside the rules.",neg,1,25.10146739,90.84058427
32,"Good luck in the national team to play well. Lac helps him a lot while playing in the league, Butt does little to do in the national team. However, he is the Confident Player. best of luck",pos,1,25.4316736,89.70464891
32,Ak innings valo kore sob ultie pello naki.... catch mis korce oitar ki hobe,neg,1,22.04113797,91.1624655
32,"There was nothing to jump so much, the competent partner Mominul was there.
Mominul is out of 94 after Fakka ????",neg,1,22.56801315,91.52313296
32,There is nothing to be able to give so much praise to the Sri Lankan telenders that runs on such a batting pitch.,pos,1,23.94683875,91.96600414
32,"After 20 matches, no play is good, only then the Prothom-alo praises them.",neg,1,24.19329487,91.82461848
32,"Air gave a little less good! Liton Das got the chance that if a son of a para had such an opportunity, he would have done better than Liton. One Liton Liton and many of the team is being suspended by the Cricket Board! Whatever he plays, he is proud of us as a Bengali cricketer and best wishes. So again we say that the oil is better than the head line can make respect! Fad",pos,1,23.93679493,90.72936366
32,"Liton Das gets a chance from the Hindu quota, in the team, playing 1 match better, for now he will play 10 matches because, say, the Bangladesh team,",neg,1,23.1676454,89.29132936
32,Valo khellei oiling hoy ghee die r ektu kharap holei 14 gusti uddhar. ...... emon ta dorkar nai. .....,neg,1,23.87270213,90.53572861
32,"liton moto valo batsman and ..
valo wicket keeper has ..
bd r sobcheye kharap batsman der 1 jon ..
they will be trying to pitch your pura batting pitch tsilo your valo bat korse ..
liton moto bowl batsman with",neg,1,23.57199653,90.43174702
32,Baler Batsman... Atto Match khelle bowler o batsman hoye jay.,neg,1,25.69582528,90.63773041
32,Liton is doing well. He does not eat meat. He has been given many opportunities. After so much time. Today you are very happy to be 98 Prothom-alo do you clear his song It's not right to sing,pos,1,23.04507098,89.96699761
32,One can not answer the criticism of Fir Jiban's 94 in the Test career. If there were 2/1 century in the full test career then some of the condemned people could have replied.,pos,1,22.68266973,91.82120588
32,"Even ten years of posting, there is no problem. This innings with the oldest quote! Wow",neg,1,23.29172337,90.91570739
32,"If you do not play well after fear of losing the next test, if you do not say that in 94 hours, you will be able to kill six in the 94",neg,0,24.93390929,89.08745633
32,"There is nothing to write about bullock.
A match and did not do well in one innings. There is nothing compared to the chance he got.",neg,1,24.88228147,91.08431465
32,"What does the brother have to show here? After 15/20, one game can be good. Regularly good if you say okay.",pos,1,25.54582944,90.71581155
32,"Liton Das is very talented, there is no doubt in it. Everyone has a bad time in the evening. Only now is waiting to prove himself.",neg,1,22.68602514,89.87274275
32,Yesterday Liton showed his own game. Carry on and wish u all da best.,pos,0,24.99333807,90.33612384
32,ki amon ahamori korse ?? Did they beat a pitch a pretty run korte and did they beat batsman that he had a hole in the rock? still bolbo bolt or batting a onek anoti korte hole bule gele cholbe na tamim shaqib mushfik akdine bhalo batsman hoyni .. tai mr liton kumar das ke aro bhalo darabahik batting korte hobe,pos,1,25.85134269,90.93242216
32,I have been doing so much time and have not been able to do anything. And one thing that is very happy in Bangladesh.,pos,1,25.85779901,91.00048334
32,"???? Hero ????? 0  ....    Bangladesh Needs regular performer like Mominul,Shakib,MH,MF,Tamim,Fizz",neg,1,23.48470298,90.17968668
32,That way 94 is 150 normal. Our problem is that we are satisfied with a little bit. We are not professionals. She is one of the national team players to understand it and it's us.,neg,0,24.29738968,90.11996048
32,"What will I write, brother, all you wrote,
Only the selectors of Bangladesh can give opportunity to people like Liton
Where hundreds of crores of crores did not bother to chew on the chest and hit the chest in the chest by mixing it with twenty-two yards in the life of his life. He is none other. Our pride snowflake is not the place for the test in the national team,
The place is,
Liton Kumar Das
Sohan
Sabbir
Sanjamul
Tanvir
Shubashis
Happy Home

In this modern era, players like Lytton can not find one,
People who do not play cricket today, like Japan and Korea, there is no place for Liton in the national team,
After playing one hundred matches in this era, after scoring two figures in one match, Patal Kumar Das is not a player, nor does he miss the stumps, but he will not even have to score in 10 matches.",neg,1,22.5595866,91.06012209
32,Why commented yesterday that Liton Das will run 50+ runs on the 5th day of today (today). There were 94 runs there. My 100+ runs should be commented Congratulations Liton Das for responding to criticism.,neg,1,24.04103776,90.60027291
32,Liton Das oi ak iningse Bali kelce. Jodi taminor motorcycle kelto. Taile protomalo monehoy litondas face ar Juno news petona,neg,1,25.91361127,90.3683758
32,"Hah hah hah
How many innings are playing together,
And there are 50/100 in it?
Can you tell me?
Then you can understand the good evil.

He's in a quota",pos,1,22.68647381,91.88398174
32,A match bal sira tal diya laise ... hayer terrible (journalist),neg,1,23.61685816,91.02606566
32,Liton balayar khaylouar white match balo korlay 10 meatch kharlayp khaylay ar sommoy imrul sabbier arato raygolaar kharaap khaylay,neg,1,22.27967725,91.17117397
32,"___ ___ ___ ___ 0 . . . If you are interested in it, please do not hesitate to contact me ,,,,,,,,,,,,,,,,,,,,,,,,,,,,,,,,,,,,,,,,,,,,,,,,,,,,,,,,,,,,,,,,,,,,,,,,,,,,,,,,,,,,,,,,,,,,,",neg,1,22.5300473,90.5711578
32,Liton thanks today.,neg,1,25.69841281,91.06890631
32,"Liton new He'll have to give time.
Tamim, Mushfiq did not come in today's place playing 5/10 matches.
They had many deficiencies. Tamim could not play quality spin balls. Today he is the champion to play Mushfiqq quality pace, direct bold was regular, Butt has no gaep today. It took time. Shakib Tamim Mushfiq Riyad of Liton Mosaddeksoumya Miraz Next Generation They should be brave if they make a few matches bad but not give up. Otherwise, we will be going to retire at the same time with a very bad time for us, Surek Tamim, Mushfiq Riyad. Who will catch the party's rolling ???",pos,0,25.5172673,91.5841956
32,gold valo technique. but negligence is karone run pay with. ektu good holei se onk valo batsman hote parole amr amr bollywood.,pos,1,23.54349378,90.23314027
32,"Sir Liton Das should be declared the number 1 batting test, the application is to the ICC",neg,1,24.46375286,90.8422537
32,"Liton Kumar Das is a potentially talented daring player. His name will be one of the best batting lists in Bangladesh
............",pos,1,25.71484797,90.73557558
32,Liton is the best liton bd future caption,pos,1,23.61491824,90.97872049
32,"Liton Das, my wealth player, can bat at such a batting wicket, which wickets like Mustafiz bat better. Unless the Bangalis do not understand anything, the treasure",neg,0,25.16029632,89.46463666
32,"Brother Sahibera Liton brother is not able to score a century today, but he will have to say that he is good luck, but for this innings he will not be able to flip the next 5 tests. On the other hand, India's Nayar had done 300 in the fastest Test against England but could not score consistently, it was still absent from the series, but if someone of our country was 300, then it would not have to worry about him and his career. This one He could have played all the jiban by playing innings. This is our country
The difference between another country.",neg,1,23.42790284,90.61015055
32,One good  innings and all started praising,pos,1,23.09986178,89.93350611
32,Liton 6 mere century korte gelo mone holo jeno innings er last ball keu ki ektu explain korben oi ball 6 jodi hoto taholei lav hoto jokhon dol biporjoi porese,neg,1,23.72171075,90.89460041
32,"Brother dropped the praise of this Baal. Bad play, you would have left the sixth of his tribe worshiping him.",neg,1,22.32565688,89.50282712
32,tmr jiggi baiup 2000 match khelle bhule 2 match match century para sondeho acheeee ... baler kheloar tar cheye parichay ke baay dia ji pichi gura polara khelee hajar ghalo hi,pos,1,24.71740048,91.32916911
32,"Actually, what will the supporter say about ...... When the wings took place ..... when the ablate supporter said that they would start the flat business .... But sadly it was not the case .......",neg,1,23.31853044,89.15427936
32,"Yellow Media Ebony Child,
Definitely condemn any person.
If someone karapera karapera him
Something has to be heard.
Play the karaoke game well.
So say something.",pos,1,23.26311103,89.37009286
32,"Because of the media of Bangladesh players are such. Play a match well with her head and dance. And the empty bread man, Sangakkara star clown in the mix, like the star of the star, the queen could not meet before. What is the need to strip so much before?",neg,1,23.78398576,91.1873633
32,"Our media !! If someone plays a match well then it does not take time to pick them up in the sky, and if someone plays a bad game, they will not hesitate to pull him down.",neg,1,22.24054844,89.98105826
32,There are some boards that are unnecessarily lamenting Liton Das.,neg,1,23.63835667,89.04971236
32,"If somebody wants to say that Abal Mominul and Liton have taken 80% of the time when the team has won the match, then there is no name in the ball. They do not have anything to do except after the chase.",neg,1,25.29110046,90.12885854
32,94 is quite enough for him to be selected for the next test and ODI series.,neg,1,24.69548004,89.25570449
32,"The team was losing control due to the catch of Liton, from which Mominul Haque pulled the team from there.",neg,1,24.81349781,91.75921232
32,"If you play a match well, there is nothing to do with the game of ten match bad game, pagol naki o kono cricketer holo",neg,1,25.99885852,90.47229754
32,"In a hahah jiban 92, Liton Das has compiled a slap in the form of a slap, and some rumors have started with that and the leftover laughs the brother, if he scored 40-50 or 30-40 runs per match, he would be better player. It was not news of Lankan who scored a hundred in two innings as the number of all-rounder Mohammad Amin was 9 52 after 5 years.",neg,1,24.98415351,91.70799313
32,"There is no profit if the series is not consistent, do not say 100/200 will be 30/40 per match. If the wicket does not come away, if you do not do hattu kapale and urine to bat",neg,1,22.64121768,91.7613472
32,"Liton is the first light maker, so he has shown in the first light, how the first light journalists have to call their father.",pos,1,25.0701998,91.07546987
32,"Salah may be the first time, but, the news of Mominul does not have any information about Liton",pos,1,23.82699225,89.33493329
32,"Liton Das will play or who will play?

ˇAgakata can not cheat, drink urine of urine and drink in the field ??????",neg,1,24.84316858,89.54734251
32,Sir Liton Das has won the World Cup for the betterment of Das 94. The only cricketer who has got the chance to win the title is Ranch.,neg,1,25.08300183,91.18695702
32,Palm-plate first light again,pos,1,22.57031501,90.31100313
32,## Sabas Liton Das .... Love u from India ????,pos,0,23.86815248,90.87232904
32,"Liton has a lot of batting, but he's more patient.",pos,1,23.40553371,91.00188167
32,His flat,neg,1,25.2597696,89.39484678
32,Litoner flat is real,pos,1,23.47730999,91.95586187
32,Liton's century would have been better.,neg,1,23.61720279,89.56629447
32,Balsel one day with dry game Prothom came up like a paura,neg,1,22.20221726,90.82301212
32,Well written brother. Good. ??,neg,1,25.44915489,90.30709684
32,Liton has understood the weather in Chittagong !!!,neg,1,24.20542815,89.0863021
32,"If another good innings is played, then the captain, then the captain will hear.",pos,1,24.3141413,89.90373206
32,Do not waste too much oil and let the ballad play for some time.,neg,1,24.62488013,89.9283933
32,Liton's story is just flat,neg,1,24.24739529,90.49846061
32,Well enough to talk Congratulations,neg,1,23.41713583,90.54676473
32,"The series should be Liton
Hopefully everyone will love him as Tamim",pos,1,25.31007777,89.87792095
32,Player of the media !!!,neg,1,22.27628795,89.31746665
32,"Yes,,he need.",neg,1,25.18135012,91.159942
32,good luck liton das,pos,1,22.05612914,91.47127
32,And an ass player will be a donkey all the time,neg,1,22.32193349,89.47897797
32,Pala tree's two-and-a-half feet.,neg,1,23.60213598,91.25740836
32,"#Halar poo addmin !!
10-match Khara dog 1-match light corlei bal Palai dey na ??",neg,1,25.04314105,90.72793209
32,"It's not good to play one match well
After that and want to run",pos,1,24.92928509,89.05385338
32,In the team for 2018 Sakamoto !!,neg,1,25.89552454,91.29908376
32,This is a match in the Bengali play Bal and the head dancing with the head,neg,1,23.41066653,91.7430947
32,"Bangladeshi 9% Manu is a bolchi, or aromat arokom bolben. stamping miss korea sheai aader harer dikea geasea.obbossho at dekben na.dekben ki beabe? jaygay here Muslim player holea obbossho bar bar first innings er khota tai repeat korthen.",neg,0,22.05890587,90.44660395
32,"Hey Babe Liton's lack of fan foil, all the Aai Hotel Karasaji ????",neg,1,25.25414133,89.05025777
32,Bating pitch a 94 eta dekhiye arO 4/5 match khaoa jabe ?????? claps,neg,1,24.37450771,90.55236612
32,Jhuton Sarker u r absolutely r8.,pos,0,23.84078181,90.28010814
32,Liton is a very good batsman but he needs to be more patient,pos,1,23.61607747,91.27334495
32,"Sir Liton Kumar Das gets ""Wisdom"" Award!",neg,1,22.01544481,89.61461711
32,The people of the unprotected people are forced to reply. Sabas.,neg,1,23.34034887,90.6950159
32,Hayera Bukha Chudara hita match is a good oil to kill oil so that O,pos,1,22.639016,91.99927255
32,Liton needs to be counciled. For increasing mental energy.,pos,1,22.00829153,91.96509121
32,"94 can play 10 more matches, does he have any consistency ???",neg,1,23.34655782,91.30712317
32,There was no need to miss the ball as a ball like a ball.,neg,1,22.40529205,89.89168939
32,"There is no qualification to be a big batsman, no one knows what to play,",neg,1,24.5720588,90.35742122
32,You are actually the team of hijra (the Prothom-alo).,neg,1,25.3453235,90.47138989
32,Do you have FLT a notu keo aschilo treatment ... ??,neg,1,25.04235825,90.18647445
32,Played sawime,neg,1,23.32673486,91.96442676
32,We want him to do well,neg,1,22.02366067,91.70727372
32,Bal Player,neg,1,23.15768695,90.64147855
32,"The only act of 100 korbs, Sedin Boylen,",neg,1,25.94066585,90.34714971
32,right,pos,0,23.37475063,91.73285501
32,Thanks Liton sir.,neg,1,22.8769133,90.75114616
32,After 40 months after Baal Palaich,neg,1,22.15745801,91.93237774
32,"When Liton is playing 50 innings before, Liton does not know himself.",neg,1,22.2876178,91.0630265
32,Liton's flat is locking on the door.,neg,1,24.52430144,89.22241981
32,"I can not be a cricketer when playing well in an innings, Kumari Das is my hairstyle.",pos,1,24.7531011,90.94837101
32,"Liton Flats Live Sometimes It Is ??
Most of them have been caught. ??",neg,1,22.6932025,90.48743261
32,"Liton Kumar Das, Mominul Haque, can not play, ????",neg,1,24.2983066,90.87984615
32,Liton will learn how to play well cricket consistently,pos,1,24.87588344,91.22635044
32,Now let's take episode with Liton. Be declared hero,neg,1,25.84152884,90.89320022
32,That's why Sir Liton is the best player of the game because of today's game.,pos,1,24.60482482,89.15627401
32,It seems like some journalists skip that Liton Das won the Nobel Prize.,neg,1,24.38695668,91.04912867
32,Liton's today's runs should be kept in the national museum ??,neg,1,24.50756155,91.23460871
32,liton kumar is nothing player.....!,neg,1,22.50778208,91.6250812
32,"Got started, oil, killed",neg,1,24.06126823,90.193278
32,"Liton's name, why should you remember the empty linen flat?",neg,1,23.27395853,90.76196855
32,"Many cricketers in Bangladesh
Comments like lovers and fanatics. Which is sad ..",neg,1,25.71374191,91.69853193
32,"The pitch that runs and runs, I can also do 200 +.",neg,1,22.15450183,89.96495517
32,"The time is not enough to talk, criticize, can be criticized!",neg,1,23.49399046,90.09005232
32,"In one voice blue.
And do not play for a long time",neg,1,25.65120195,90.62023145
32,"Shabas Liton, come forward. You and Soumya are the future of Bangladesh",neg,1,22.22615067,90.4655036
32,There is nothing shown. The question of his own existence has to turn around.,neg,1,22.58448648,90.95449544
32,"Sir Liton, you go ahead! The whole nation is next to you!",neg,1,23.73041048,91.82660299
32,"Two consecutive centuries, Muminul Haque wrote something about. Liton zero to Mamunul",neg,1,24.8027787,91.19163498
32,Admin Brother gave Liton's flat address. : D,neg,1,22.78847808,91.93318742
32,permanent  for next 1 year,neg,1,23.98386471,90.6248608
32,"In future, like batting",neg,1,22.29795111,91.90550934
32,E wicket 96 Bappar No ..... When I saw Mirpur,neg,1,24.43370639,89.26666227
32,welcome Liton the,pos,1,22.99835014,91.22637738
32,Has started,neg,1,24.71440146,89.0486414
32,ODIs> Liton flats <Play Muminul in place.,pos,0,22.17036082,90.33548792
32,Itching started ...................... will continue for some time ..................,neg,1,22.78003406,91.31574345
32,Waiting to see how long this light is used in the first light.,neg,1,24.01358646,89.63285421
32,It was all done if one match was good. Azab News is also the first in the light of Mathan,pos,1,24.36787574,90.26807094
32,Snow Imran's younger brother .... !!!!,neg,1,25.51341841,91.57178995
32,Liton I got a lot of candy stuffed,neg,1,22.44611199,89.9775957
32,If Bradman is sir then Sir Liton Kumar Das and what is less?,neg,1,25.0712333,89.43505391
32,Sports Reporter has become a poet - Fawl Analysis,pos,1,24.74686584,89.59491464
32,"Liton Mama is very good playing, so favors, and greetings from ours, ???",pos,1,22.28701098,89.60362267
32,!r,neg,1,23.69854896,90.36928966
32,Playing a match,neg,1,23.87781177,89.58883887
32,"Hey beata silent. If a match is good, then forget everything.",pos,1,23.60198355,89.00218599
32,It is difficult to understand how much 3 fifties playing 27 innings in total,neg,1,24.91671714,90.9901217
32,Akta download player ...,neg,1,22.75291257,91.96945251
32,1 match vlo khellei light player hoa Jaina.,neg,1,24.29386916,89.03912975
32,Give Liton Das a leakage on your first page.,pos,1,22.74191362,90.45514176
32,Hindu Kota Player's first success. Good in one match with ten match bamboo.,pos,1,24.63203729,90.12476092
32,What is the need for air?,neg,1,25.94038943,91.72204783
32,"Telling the media, stop killing oil !!",neg,1,24.3436892,89.86614996
32,"Nothing is better than the uncle, but the beginning and the end is good.",neg,1,25.14908002,89.63495349
32,"Played a match, seems to have won the Mahabharata ????",neg,1,25.96775072,91.5526239
32,Kiping and fad,neg,1,25.9888795,90.18274704
32,You can also It is not late to get late,neg,0,22.07345953,89.27584692
32,Everyone will have to surrender in every match.,neg,1,25.38911415,89.13003631
32,"If they play bad for you, win a match, then shake it in praise,",neg,1,22.54953305,91.54079124
32,"Wake up the media, you get it.",neg,1,25.62518363,91.5183484
32,How do you see it in the next match without a hakadak with one match?,neg,1,22.90446881,89.2456277
32,Brother oil 1 to less,neg,1,25.73094624,91.06841534
32,"One year later, his name is now Sir Liton Das for a match to play well",pos,1,22.51151536,90.73439888
32,liton kmn player sayta sa south africa proman krsa jkhana sby hotash krsa sakhana o onk valo krsa,pos,1,24.91875956,91.34942939
32,Liton Das today is worth the thanks.,pos,1,23.29034308,90.76465669
32,Sala sir ...,neg,1,24.37408157,91.81153192
32,Now it's just littanera kujate. Why then?,neg,1,22.59581993,91.02313006
32,The story could not have been that way ...,neg,1,24.66729913,89.55399648
32,,,,22.04462713,91.51135102
32,liton valo player nisondehe khali sojog pai na,neg,1,22.27289022,89.80679569
32,I think Musharraf Mashrafe Shakib would have won the match if there was a captain,neg,1,24.05872827,89.2027382
32,Hairstyle leiton,neg,1,24.90000123,90.2854103
32,Players should not give a brief press briefing when playing two matches,pos,1,25.68483992,91.06514113
32,Let Liton be a Muslim. ??,neg,1,24.5522506,90.01266235
32,The first light that is a fad player is the fable,pos,1,22.50945827,90.27998855
32,Baal News,neg,1,23.28263185,90.6742503
32,well played liton. hope its beginning.....,pos,1,23.23319337,89.83758432
32,"faltu ekta player,he is not perfect for national team",pos,1,25.70656818,90.67211325
32,Liton is bad playing well. But I love his short fame.,neg,1,24.23032595,90.5648528
32,Liton today showed his flat performance tie,neg,1,25.89081901,91.02069333
32,,,,23.15455252,89.3784726
32,,,,23.56136393,91.71646574
32,act faltu,neg,1,22.9818883,91.46254995
32,Liton took lease for two more years,neg,1,24.59585411,90.0891485
32,One has to prove itself. One match can play well. But it must be maintained continuously.,pos,1,23.03155275,90.72686194
32,liton ar mito sugok ami paile or thak a onek valo o khaltham ak match valo korle valo pleyer hoy na,pos,1,22.30557756,91.00257586
32,One Innings Delivered 15 Tickets Confirm Corollo,neg,1,22.17385077,89.6684529
32,"Well, if it's okay",neg,1,23.2931576,91.11630161
32,1 innings!,neg,1,23.01922714,89.89857626
32,Look at the eyes closed,neg,1,25.47033994,90.63651645
