NewsId,Comment,Sen,Con,lat,long
23,"Almost you throw a vote for the masses on different topics ... but you vote, but how will the nation benefit from this vote? ??",pos,1,23.0769219,91.93891794
23,Tired of voting and what would be the outcome after getting result?,neg,1,25.61593468,91.29404558
23,"Each tester should have one projector, the Internet will be there. In one case, the education ministry will be released from the Ministry of Education, in the project project. By doing so, the paper will survive. The question paper will not be flushed. Investment once.",neg,1,22.31185224,91.61585181
23,Anyone caught can not be a criminal. He is not so easy to catch Kathla. He will say that after two days the question is not leaked.,pos,1,25.0333778,89.63620962
23,"The person will catch the person who is mad, the education minister will say before him, you are the main culprit, before you take the money and this five lakh is my",neg,0,25.26012324,90.67917228
23,"Suppose you are a thief and I will let you know it, but you will blackmail me on the other side and you get rid of all the clandestine cases with some money. We are now in the background, we are now with this leak. It will be resolved It does not seem to be that. If every parent says that my son would be honest, then it would not have happened. They do not want to talk about A + + education and education. And one thing is to say Exchange also definitely appreciate his desire to finish f nakarana abasai million over the quarter pichaneekata hand of a thief, kill desajanagana they are rich.",pos,1,22.00215165,91.68804872
23,5 lakhs of rupees will be given to Nahid Kakku on the behalf of the country.,neg,1,22.6013573,91.80207109
23,I think all the SSC examinees of the country should give a grant of Tk 20 lakh to the education minister and retire.,pos,1,25.02032889,89.44534966
23,"After this announcement the Education Minister has been demanding Ekushey Padak.
May Allah bless him with taufiq !!",neg,1,25.49678469,90.62026414
23,Why are mobile marketing companies available for women? Why do you have to pay? If so much money? For,pos,0,22.98603057,89.56408045
23,The questionnaire has now become a regular topic. For which education authority is responsible. The bad guys of the fruitful crop will start getting 5-10 years later.,neg,1,24.6006491,90.19294604
23,Best joke of the year.......,neg,1,24.99065372,89.99865527
23,"Who will pay their money to
Papa will give her a prize or a son or daughter. They are thieves
Here's what 500,000,000 rupees is worth if you pay 50000000000000.",pos,1,25.54054569,91.81855673
23,"On Era of Modern Technology, it's a very childish announcement.",neg,0,24.35367974,89.50371392
23,If the thief is looking for a thief then what thief will you catch? What is the feasibility offered by Chikamamanti ..,neg,1,22.57766145,90.82362475
23,"Maduruddin Nurul, who was able to show you the questions, who leaked the question.",pos,1,22.914712,90.0367189
23,"To get rid of leaked question papers, take action - as in case of narcotics.",neg,1,25.22408536,90.98337718
23,"Do you know how to make Ganja Banaila?
Pulling the head in the tunnel
What's the way to do
Do you know how to make Ganja Banaila?
We do not have anybody to do, so we can do whatever we want",neg,1,25.8813084,89.70428742
23,"In the month of Chaitra, the main character of the autumn moon, Chaitra lost a cow and came home after searching the cows in Chaitra's house and said to his wife, 'Water drinks eat mother's food', standing next to her son's son clap, she said, what fun is fun ... Dad is calling my mother! The person who lost the cow then asked for the son: In the Chaita cow Harail, you are the brother of brother, brother!

Cancellation of examinations, 5 lac money prize inquiry committee, one can say these words when it comes to duty.",neg,0,24.46983088,89.93496193
23,"After some days, maybe it will be said, let us refrain from leaked question papers.",neg,1,24.59776198,91.1673437
23,Here the government is seeking help from the people in the place where the people will help the people. My gold bangladesh,neg,1,24.35359167,91.5173665
23,"Stop all these plays Bangladesh's administration is not so weak, the minister said.
General people and not so stupid, sir. You can destroy the militant dormitory by getting the news secretly.
Why not stop a little question?
The secret formula works only with the militants, all other corruption in the state, black clothes fall?",neg,1,25.34043749,90.30968796
23,Only solution crossfire.Its Destroyed our nation!!!,neg,1,22.92948611,91.93333183
23,All types of sexual practices should be exposed in the country. Coaching stopped untill the college closed on Friday. Khamkhialipana will destroy the country's future. The real culprits will be punished. Arrangements will be arranged. Then the question will be closed.,pos,1,24.98629296,90.83935828
23,"age education minister dora hok, onar kaj ki, ki kore fashoy, tini valo kore janen",neg,1,22.59369573,91.06659083
23,He should need to regain with take the liability & responsibility.,neg,1,24.22477979,91.39008302
23,"There is no comment, because if you talk more about the suspicion will come towards me. Hierarchy",neg,1,25.20313864,90.16861092
23,"The Education Minister himself is involved in the leak of questions, he is pushing the country towards destruction. They are cheating with the nation and students.",neg,1,22.82488438,89.19951458
23,"Loja is in the background. Apni bertho, to dayitto chere din, apnar sather lok jon e to prosno fas kore, apni dekhte pan na, tahole sadharon manus kemne dekhbe ???",neg,1,23.55785983,89.6063925
23,"Girl jara birup montobbo koreche tarai prosno faser sate jorito, eder dora houk,",neg,1,24.57914311,89.30151907
23,"All the people from the class One give you (#Kakku) A + with A +, so there will be no leak for the question, the life ministry is Nakan oil.",pos,1,22.4845547,89.46443229
23,jara prosno fas kore tara desher sotru. ader jabotjibon ba ba direct guli kore mara uchit.,neg,1,25.6190958,89.00040807
23,"The minister, you are the thief, you will be caught by someone else. People will catch you, and 5 lakhs will not work on that day ;,,,",neg,1,23.19439209,89.53201824
23,"Until good governance is confirmed, criminals can not get away from crime. Because I am the BPP my party is in power, again I make Awami League my party is in power, so all my crimes are not an offense, when this attitude works, they become more vulnerable to crime.",pos,1,24.69493491,90.11504655
23,"Once said that there is no leak, once again the five lakhs if the hand of the leaked! What kind of healthy people is this?",neg,1,23.0398353,90.15628384
23,"The more educated the nation is, the more advanced it is. And the more people who ask for higher education by leaking exams, what does the nation say?",neg,1,23.44549133,91.81018456
23,"If the question is leaked, then why do not you resign? He is keeping the appraisal tension apart from the tension of the testers, 30m will come before the center, otherwise do not give the test, if the question is leaked, the test will be canceled. Q Does everyone leak? Why should all the boys and girls be punished without taking them? Many may have many problems in the center, so if they do not come to the center of the exam can be examined. Now the question has been leaked or why he does not resign?",pos,1,25.32747235,90.72130738
23,"""Education is the backbone of the nation"", the education ministry should be the bearer of the spine and the minister is the head of his father
! If the father does not have the backbone, then no one knows how bright the future of the nation is. No one knows how this invertebrate is still alive in the chair. Can the Honorable Government not understand the factories of this factory?",neg,0,24.25544316,91.15011979
23,"What is the guarantee of money? Where the paper printed at less than 1 rupee and less can not be kept properly, there will be five lakh taka before it can be forgotten.",neg,1,22.8621095,91.47020868
23,"There is no desire to catch. Because the person who uploaded the question in the first nets and the person who shared the question, the arrests of the people will come out, the main mystery will come out.",pos,1,25.10469511,90.16528573
23,"The policing thieves were given up to Rs 5 lakhs by the policymaker. If you were to sell the case, you would not have to pay a comma.Joano ebobasata nawa hoise",neg,1,24.70496313,90.45271176
23,Nahid Kakku is the thief himself ... Five lakhs of rupees are given to him ... Chhala Beitla Harami ...,neg,1,22.27271099,89.17646698
23,"Nahid sings for Qasqar question.
The question of whether or not the child is being questioned after examining his child again",neg,1,25.93465257,89.45309662
23,"For the wife who is pursuing her, go to Herbal without spending money to catch the young man's neighbor. If the girl can not get out, she can not blame the boy.",pos,1,23.94079511,91.39189234
23,"Ajou and I have a lot of time ago. . Well, killing is far from being killed? What? What?",neg,1,22.75809313,89.73235163
23,"In Bangladesh culture, such a prize will not be able to catch the culprit, because it will have to suffer from the fact that the law will beat it.",neg,0,24.9132521,89.35419802
23,"And, karon doriye na diye o question paper sale kore 10 lakes earn korte, it's easy",pos,1,22.30503349,90.0942982
23,Wow! Finding such an offer on the day of money in the drought. You're ready for the Thai Thakkain. I'm saying ...,neg,1,23.68663489,89.24779308
23,I now dream of becoming a millionaire !! All the thieves will not be caught until the income! Ah !!,neg,1,22.60895768,90.61491248
23,"The vulnerable gloves need to be shatered on the public stage. Shala stadium still does not resign, and why do not we also do not represent the illegitimate people.",pos,0,23.33767949,90.05331126
23,The criminal is himself ... the prize money will be given to his father or will from his own pocket ... go to the top and save the nation. Do not play with the money of the nation.,pos,0,25.37352451,89.97594894
23,"By showing the roads, the nation can not be brought to the shadows of development, as long as the education system will not improve and the reduction will not reduce. I understand the government is silent?",neg,1,23.57206642,90.4125051
23,All the answers are with the Honorable Education Minister. What are the benefits of getting extra rewards to people?,pos,1,25.69018945,90.51540527
23,The minister must first be given to the police. As head of the department he is in line with this.,pos,1,25.81855305,89.86563949
23,"Who has the prerogative of the question paper, all of them can be known, what is the need to play.",neg,1,23.6744234,89.98584561
23,"If you do not give so much talbabana, you can only give the people of Jirilai jirilai, the minister, Mahatoya, your desire to shame,",neg,1,22.36512995,91.75656769
23,"How much does the software have to do with the new tacer channel, which is the best of the basin industry, so beparta rohossoi theke jabe?",pos,1,23.16167325,89.39643502
23,"If you want to know more about this book, then go to the teacher and ask the teacher if you are looking for an exemplary person, then you should try to find out if you have any questions about it, and then you can ask me to do any other work.",neg,1,25.20454531,91.50398507
23,Extraordinary concept Thieves Thought Models Manus Tech Kabaab Dhabay?,neg,1,23.71800891,89.89668583
23,Education Minster Private Jr. Amy Dariya Dilam 5 Luck; Awards Tea,neg,1,25.39303165,90.46585072
23,"Asked to be more conscious and honest with the people involved in making the question, the country will lose both the money and honor.",neg,1,25.7499878,90.63379452
23,"You have to wait for a few weeks ago. yes, what do you think of cash and deya hobe naki kind e? How to make a deyar system crazy?",neg,1,25.00091824,91.0301471
23,5 Lac Taka Kee Or Bapper Taka Naki ... Public of the era taka diia Prize to Dibe ... You about Podtag Corbi on .... Pislar Woe to the Pisces ...,neg,1,25.43528249,89.94402796
23,Now one of the involved is who will get involved. There will be two-and-half calculations?,neg,1,24.60661717,89.35185379
23,Yes..,neg,1,22.96203971,89.70887979
23,Party people have done this and the party's people are banned in the Awami constitution.,neg,1,25.5398988,91.10737047
23,"This news is for the whole nation, the education minister is outrageous",neg,1,23.28732672,89.14024054
23,"Who does the education minister resign? Surveys about this,",neg,1,25.36647611,89.08885809
23,"There is nothing other than Iwas, where her daughter's son-in-law is guilty",neg,1,22.45996538,89.80198804
23,"If you have to say it. Then it was okay
Come on, understand.",neg,1,22.16889502,90.14492696
23,The dust of the mustard that the ghosts in the rain!,neg,1,24.37540398,90.82221478
23,This is ridiculous !,neg,1,25.88160011,89.33068405
23,Thieves will be caught if the chicken puts mortgages to the fox? !!!,neg,1,24.12237545,89.34333092
23,Jokes of the year ??,neg,1,22.20281622,89.70113187
23,Soodesher Bhitore etc,neg,1,22.81185587,91.71978595
23,What is the thief?,neg,1,24.61028626,90.04067589
23,Want to know whether the voting results will be shown to the minister?,neg,1,22.35877254,91.39334345
23,The leaders of the leader of the elite linked to it have forgotten that I and thieves can steal all the ministers and thieves,pos,0,23.11694743,89.23867934
23,"5 lakh taka education minister will sell his father's wealth or not?
Want to know it before",neg,1,22.84552934,91.80856668
23,"The questions will be leaked.
But it will not be Bangladesh,
I think.",neg,1,22.35925244,91.25181598
23,"No! Because the people who are doing these, they are powerful activists!",pos,1,23.76673441,89.70673998
23,,,,22.15638942,89.711568
23,,,,25.26388865,89.30852301
23,Try it. Any way. It does not work in one way or another.,neg,1,22.93515594,90.17960985
23,So Funny...!!,neg,1,25.51927133,89.54169705
23,There is no confidence in your own house,neg,1,23.33946772,89.02552674
23,"If it was the speculation that Nahid should resign, should not he?",neg,1,25.54866973,91.21446591
23,Announcing the prize itself for income?,neg,1,25.54531172,91.84973962
23,The person involved with the leaks will not offer 8-10 lakh rupees for the sake of not letting ????,neg,1,25.87128857,90.67750689
23,then you can download the podotag for free download,neg,1,22.27521409,89.1712315
23,The ghost in the moss,neg,1,25.93882502,89.27353056
23,When the champion is the spoiler the people are helpless.,neg,1,25.81426443,90.0273236
23,Prosno potro to fas hoyni 5 kÑ paben na,neg,1,24.94816367,91.35831277
23,"Nahid's son-in-law, Hameed H Sarkar",neg,1,25.40094594,91.76962864
23,He himself might have sold the question papers for millions of rupees,neg,1,22.00243152,91.4042864
23,Because he is a thief himself,neg,1,22.17996047,89.41440119
23,Must read! If Gulistan is around the shrine.,pos,1,24.81294947,91.30769222
23,Tukla's girl needs to see if she is involved. ??,pos,1,25.17434963,91.08993464
23,It would have been nice if there was another option to give 'hah' to the poll.,pos,1,24.27873424,91.5960332
23,Nothing except a farce,neg,1,25.35036263,89.60197247
23,5 lakh taka from his pocket? He does not have any problem to pay the public money.,pos,0,23.72463174,91.65691783
23,Sala pagol,neg,1,23.00797849,91.86223868
23,"He is alive and not ... Because he is a thief, he himself",pos,1,23.52737943,89.88936597
23,To whom will I give my questions?,pos,1,23.15239399,91.00855267
23,If Prothom Alo thinks that the criminals will be caught in the 5 million?,neg,1,22.2252169,90.60651273
23,This is the best jackpot of the year 2015,pos,1,22.72676399,91.05987279
23,Not 100%,neg,1,25.45834079,91.04172814
23,Anyone who can be caught will be trapped in the opposite case.,neg,1,23.88105864,91.66462312
23,Na Vaheer Chor Ki Sahje Dora Jai ??Boleen ..,neg,1,22.76628177,90.60112243
23,He is the thief who he is,neg,1,24.88746389,91.60486338
23,No haha ??reaicht with it.,neg,1,23.01528127,91.08328379
23,Five million will not work. Dump,neg,1,23.74137188,89.80360995
23,Nahid Kaku himself resigned as the only point of shame.,neg,1,24.80509717,89.1632837
23,"Nurul Islam Nahid, I get five lakh rupees",neg,1,24.47258429,91.19622752
23,"If the culprit is the announcer himself, then how can you?",neg,1,24.12760006,90.40020429
23,Do not catch,neg,1,23.63602996,90.21501578
23,"If there is ghost in the mustard seed, what will be there",neg,1,23.57149779,89.20278071
23,Five lakhs will be given to some? And the car will go from the pocket?,neg,1,23.03828826,90.99333818
23,No exam no leaks,neg,1,22.15549752,90.00617559
23,shikkha montri sob korcen vlo but jara prosna na pe nijer moto kre koste kre pore j exam dicce tader jonno keno i ne saste pawna jati ki kiku bol na cup kreu sojyo korbe,neg,1,23.97956774,91.89053435
23,"Brother does not let me hold
I'm leaked the question ..
Two people share 5 lakhs of rupees ...",neg,1,24.86723809,91.83810582
23,"Do not tell the voters of the thief, it will be all tick,",neg,1,25.93115571,90.78452918
23,There is no need to play outside in the house without a thief !!!!! Understand the people,neg,1,22.80714979,89.33856414
23,Thieves will never be caught in search of a thief throughout their lives.,neg,1,22.83300223,91.40961436
23,No,neg,1,25.39262263,90.10384643
23,No Ghost in the mustard. The rice was consumed by rice.,neg,1,25.3850032,91.14078378
23,"Dada jamma will not be caught. Because
The person who is making the announcement is himself a member.",neg,1,25.08665488,91.82822225
23,Dualityfinder,neg,1,25.3877312,91.41561464
23,She is involved in herself,neg,1,22.47562195,91.1945338
23,"If the man and the madman are crazy, by obstructing the rope or the rope crazy if you do?",neg,1,24.97601324,91.2774255
23,Yes,neg,1,25.59024357,91.91812693
23,Hat,neg,1,25.94024257,89.5665553
23,Scorching ghosts and now the mustard is entering into the ghosts.,neg,1,22.4589571,90.59642194
23,"No,",neg,1,24.28666623,91.57343033
23,"5 lakhs of rupees which will be removed, maybe he will be fishermen because the rules of our country is another type of work",neg,1,22.04722166,91.57968228
23,Nah,neg,1,22.53055051,91.29004342
23,"For those who give 5 lacs
And the one who gets him crossfire is okay",pos,1,25.98962063,91.01129154
23,"I know who the minister is the lord, the award is not Pamu !!",neg,1,23.89356629,91.47739551
23,Let's finally kill him,neg,1,23.67437104,89.34202395
23,No .... those who declare it are leaked .....,neg,1,23.00152989,91.28549535
23,No,neg,1,23.98274697,89.50130001
23,"Do not forget ,,,,",neg,1,23.7721042,89.45019
23,"Like a father-in-law, father-in-law. Education is going on in the charity of 2 people.",neg,1,23.66869604,89.77600373
23,"Those who investigate, they are asking out. It is my belief
This is not the case at all",neg,1,23.31564256,90.76521736
23,"5 million donations!
The criminals will hand over to themselves ??",neg,1,24.80052348,89.59899336
23,Did any goat 'yes'? Let me know if you see this comment. See you a little,neg,1,25.77197332,89.93356046
23,"Does it take so much? Followed like Sunday movie, all will come out.",neg,1,24.95781116,89.36022119
23,Leaked the donor with 10 million rupees,neg,1,23.55032631,90.02839308
23,NONSENSE BELIEVE EVERYBODY IS NONSENSE !,neg,1,23.6098568,91.93424382
23,Here the minister of education was involved in myself and if I could get him caught.,neg,1,24.91927644,91.01100632
23,,,,22.37861227,91.31247378
23,,,,23.41045421,91.07011926
23,,,,23.62061031,90.23934945
23,No education has ever seen anybody in Bengal's history.,neg,1,23.64469944,91.69127406
23,There is no other way than his resignation,neg,1,23.83829131,89.98092125
23,"The 5lac prize on Diya, the dream was not the chare dile Valo hoy",neg,1,24.9225942,91.55231128
23,marunas fantasia,neg,1,23.12452298,89.71929926
23,"Than to comment, it feels more fun ...",neg,1,22.36190295,89.59277023
23,: People will be caught when they are aware.,pos,1,22.06389027,89.46957825
23,Because criminals will never be caught.,neg,1,25.99627626,90.83571286
23,Onno ksute jkn kaj hyni..so eta try krse..da jak ki hy ...,neg,1,22.09346828,89.97960302
23,"Do not mean to be caught ??

? mean that the criminal himself will be captured.",pos,0,25.6450324,91.43372465
23,It's an inconvenient question,neg,1,22.31971523,89.16990034
23,kno go vai desh ta jmn choltysy tmn cholty deo na ... posno fass holy karo ki tmn poblem asy ???,pos,1,23.0521553,90.19555714
23,Does he eat food? Where is the fatal idea comes from the head?,neg,1,25.93783897,90.26918341
23,I do not know,neg,1,25.38897821,90.95873668
23,The question leaked without the resignation of this minister will not stop.,neg,1,22.41345468,91.79266303
23,It's a question posed by the question itself,neg,1,22.61747276,90.78990203
23,It was said in another country. Want to hang the minister!,neg,1,22.55469171,91.45254367
23,You have to catch the shawl before,neg,1,25.57107049,90.16388185
23,The question of how much money is worth 5 lakhs.,pos,1,24.93523756,90.36655267
23,Then the education minister's son Imran H Sarker was arrested.,neg,1,24.7030937,91.22887709
23,How can I get education minister?,neg,1,24.2641698,90.57991815
23,kaku may b pagol hoye gese,neg,1,24.59459092,91.71460606
23,The pagol hole dore becomes r ... ultra-kore fasai ........ je vekub se korbe .......,pos,0,25.81404425,90.91929132
23,No ..... all is not in the money,neg,1,23.11501645,90.8264502
23,"I want to hand over the Education Minister to the question leaks,",neg,1,22.20454215,90.79643136
23,The darkness behind the lamp ??,neg,1,22.59055347,91.39160439
23,The criminals will be alert. Because Raghav Boal is involved with them. Other ways will follow.,pos,0,25.36347432,89.86508353
23,The result of such a vote will not take time to stop this polling.,neg,1,23.02071368,91.38299201
23,"Leaked the question, but in tolerable levels! : D",neg,1,24.64042948,90.65818952
23,I got education minister.,neg,1,24.41541849,90.92002744
23,Polling with non-partisan government We want to see what people want in the country. What do people want in the country?,neg,1,22.86685316,89.23999992
23,Tukla is a crazy,neg,1,23.7088169,89.09429679
23,Naaa Vote ....,neg,1,23.17831477,90.30556022
23,The maximum punishment for this is 'hanging',neg,1,23.70762511,91.20147088
23,,,,25.7712728,89.76717188
23,I think Imran H Sarkar can say goodbye about this ....,neg,1,23.58552343,90.50112169
23,"Taka 5 lakh fine for trade in crores of rupees
Selukas",pos,1,23.68397208,89.70255176
23,"BNP, Jamaat are involved. The award will not work.",neg,1,22.10952256,89.76162941
23,There is no such a terrible minister in the world.,neg,1,25.66972906,90.70639983
23,Minister of the Law,neg,1,23.41838543,91.56941645
23,Where will the ghosts be caught in the mustard? The unpleasant bulls are nothing else.,neg,1,24.43421281,91.57001287
23,He should resign before the Education Minister himself is involved in the leakage of leaks.,neg,1,23.48716434,89.66766274
23,Tuckala girl will be caught by the accused. He gave five lakh rupees.,pos,1,25.62599553,90.63128901
23,saheb mal saheb er moto moja suru korse ...,neg,1,23.07801836,91.91041349
23,,,,22.13014943,89.56169601
23,agey to dewa hok porey nijai dhora dibo?,neg,1,23.43129581,89.26177294
23,Stop the test!,neg,1,25.36523484,91.59274209
23,Khankir pula nijei to fash kari........Amr 5 lac dey ohon,neg,1,22.26738959,90.43599149
23,The government can not pay their salaries on the next day.,neg,1,22.59795571,90.16243453
23,The criminals are the people of his party. How to get caught?,neg,1,25.54626504,91.35669133
23,"He talked like a saint's father
So it would be better to give the prize to him",neg,1,22.21199129,91.15874639
23,Education Minister needs to be arrested because he neglected the responsibility.,neg,1,22.13943418,91.56527786
23,Change the teacher all right.,pos,0,22.54202891,91.90067129
23,"Crazy or sala ,,,,",neg,1,22.42868831,91.0994631
23,nice question ??,neg,1,22.36159545,90.54665721
23,50 crore will not be caught,neg,1,25.4504741,89.62550509
23,"This will not work with all the alms minister.
Need Original Education Minister",neg,1,23.5602494,91.01008446
23,"If you have a ghost in the rainy season, how would you look for the ghost? :-D",neg,1,24.44898561,89.55253973
23,Porbe.but sdaron manus.boro raghob ra dora choawar baire thakbe.,neg,1,25.04878196,91.99121104
23,"If there is a ghost in the mustard, then who will be the ghost!",neg,1,22.50355081,89.97698662
23,Do you survey these requirements?,neg,1,22.35581092,90.45037266
23,It will not be possible in any day if not the rule of law,pos,0,24.80822147,90.15834779
23,"The criminals are the sons of the MP, the MP's boys, then who will catch ,,,,, ????",neg,1,25.44908056,90.46333898
23,His own daughter's son-in-law is involved in the Imran government ...,neg,1,25.29533785,89.10984442
23,I think the minister is responsible.,neg,1,25.67443684,90.47993893
23,The minister feels himself involved .... Nurul Islam Nahid should be handed over,neg,1,23.48816587,89.68168066
23,What is being kept in this mind does not come to my mind .......,neg,1,25.31112389,91.58112244
23,Never,neg,1,23.81829233,90.52737883
23,"If you keep the net of the country for a month during the test, it will seem a lot,",neg,1,25.00110505,89.13763945
23,Auporadhi tar charpashe,neg,1,22.73136439,89.59210242
23,never,neg,1,23.19686514,89.19252555
23,"dorte parbena sae crke
????????????????",neg,1,23.06052076,89.12673969
23,It does not seem to be profitable,neg,1,23.76428665,90.46714741
23,"Sorry if you do not have it. . . . Sorry, this is it too: D",neg,1,25.66866009,89.0445549
23,Admin ar question wrong.,neg,1,24.73806553,89.89995229
23,1 number #coor?????????????,neg,1,23.68852932,90.66382316
