NewsId,Comment,Sen,Con,lat,long
23,"By all those who are lying on false charges, stealing and unpaid bonds ... These are very ridiculous ...... !!!",neg,1,22.56,88.9
23,"That is why they steal the poor thief in stealth and say everybody ... Our common people like you ... There is no time to give ... It is necessary to divide the future, brother who will have to be fired. There is no food in the house.",neg,1,22.56,88.87
23,MP Badi said that he is talking about this kind of yoga against Yaba!,neg,1,22.56,88.84
23,Amarnath ki kunatak chorre tatta tayar karne baat pari thi thi tha tayne tamne manus ka ki bishtha kora nahi,neg,1,22.56,88.81
23,"Q When the leak is not going to stop, why not just stop coaching, the Education Minister is leaving. I do not see any reason to hire 15 lakh educated people. Due to the opposite of the opposite days that will not be good.",neg,1,22.56,88.78
23,"If the name of the real culprit is named then it may be seen that instead of prize,",neg,1,22.56,88.75
23,"I can say that it is the minister who can do it. It is not possible for ordinary people.
Where are my five lakhs?",neg,1,22.56,88.72
23,"The Ministry of Balance, if the groom's groom frees him / her from the job, he will be cold.",neg,1,22.56,88.69
23,Are koto husir cheer Hovay education system. ??????? ......? ....,neg,1,22.56,88.66
23,He just make the question price higher than before !!!,neg,1,22.56,88.63
23,"How will the comedy Nahid Kakku? The protest rally by Kakku Jamaay, then they ate together with the meat of the bark of the bark. The takku kacqui Anaf",pos,0,22.56,88.6
23,"Alas, what is the country, and I do not have to say anything.
Hooliganism will annihilate throughout the year and the exam will actually steal the question. It is in their lap. I will not say the name of this Dalal you will understand which party can be. They do not have SSC, they steal the question of all the questions. But what will be the benefit of this will be a certificate of paper and nothing else will happen.
I can say by chewing off that this question can not be stopped by the Awami League while keeping it in vain. Because those are those who are theirs. How about",neg,1,22.56,88.57
23,"Keeping the identity of the donor confidential, and rewarding two people can be useful.",pos,0,22.56,88.54
23,You are suffering from obesity 'Quantum Disease'. It is necessary to take immediate care after resigning. : Dr. Dimran H Sarkar,pos,1,22.56,88.51
23,"# Cabinet_r_broad_premak_a_n_n
Prime Minister is silent, despite the accusations! Why should Nahid sahib have to be a minister of education, should immediately resign his!",pos,1,22.6,91.6
23,Hahahaha .... Feeling chodna. 5lak er mamla akhon 5hazar a mite jasse. Then dhorbe ki kore ????,neg,1,22.6,91.57
23,"What is the need to see the exams, the master and the test controller wrote himself, but the rate of passing is not being done by the students. The question will be closed, the rules will be closed, if the money is deposited in the test, then he will have to pass, then the question will not be disturbed",neg,1,22.6,91.54
23,"If these people should listen to them, they will also say that I am tired of eating the goods and how it is.",neg,1,22.6,91.51
23,"Thieves are so bullshit !!
And now the value of A + is more than 5 lakhs so that the life of Polapran will not be thief",neg,1,22.6,91.48
23,It seems like the Education Minister is involved with question leaks - otherwise the question papers will not be leaked. There is no profit by declaring the prize - it may stop if the education minister resigns.,neg,1,22.6,91.45
23,"In front of a lot of cheats, chestnut porcelain zander, dubo duck, cheap china day See Protees on the Way",pos,0,22.6,91.42
23,"Criminals have leaked the question using such technology. The minister can use the same technology to catch the culprit. But instead of doing it, it's just playing in the name of criminal section.",pos,0,22.6,91.39
23,"The questions are not available to anyone from the air. Their questions are not getting out of the center even after one or two hours of examination. Nijaz's house and own storages must be fixed in advance. If you do not know, then you should not put your blame on others' necks. If the problem is out there What is the fault of facebook here? If they stop here, do they still trade in other ways Can not ete? Minister is very urgent administrative efficiency is superior to resign.",pos,1,22.6,91.36
23,"History is the best shaky statement.

If you are called a thief, it is a sin to steal. The thief says that I steal it as well. What would you say

This is the statement of the education minister, because those who question the fuss are in the air, that they will be punished.",pos,0,22.6,91.33
23,"Take the responsibility of charging for 1 minute abroad and resigning at the office, and in our country, every time the questionnaire is tough, it becomes hard.",neg,1,22.6,91.3
23,"You will leak, you will get reward,
What Circus Ray ......!
A ridiculous helpless minister,",neg,1,22.6,91.27
23,"The people understand, know - he is not anybody, the Minister of Education is himself, he picks up the question of eating the money, and plays in front of the media. The minister said, do not play the money, how will it be? And the bank balance or how to increase day by day. Line",neg,0,22.6,91.24
23,"It is not possible to give 5000000 lakhs, because if there is a ghost in the river, it is impossible to chase the ghost by the mustard and not only in vain.",neg,1,22.6,91.21
23,"If the question papers are closed or the examinations will be canceled, the Education Minister, but if there is a problem in the Bangla question paper, then the test will be canceled? Will the Bengali test again?",neg,1,22.6,91.18
23,"As the house does not survive in the rats of the house, it is not possible that others can not be questioned. The people of the education system are people of the education ministry.",pos,0,22.6,91.15
23,"Sir,
Questioning the value of the value! Whose hand will we entrust to him and who can understand the money from whom?",neg,1,22.6,91.12
23,"Almost you throw a vote for the masses on different topics ... but you vote, but how will the nation benefit from this vote? ??",pos,1,22.6,91.09
23,Tired of voting and what would be the outcome after getting result?,neg,1,22.6,91.06
23,"Each tester should have one projector, the Internet will be there. In one case, the education ministry will be released from the Ministry of Education, in the project project. By doing so, the paper will survive. The question paper will not be flushed. Investment once.",neg,1,22.6,91.03
23,Anyone caught can not be a criminal. He is not so easy to catch Kathla. He will say that after two days the question is not leaked.,pos,1,22.6,91
23,"The person will catch the person who is mad, the education minister will say before him, you are the main culprit, before you take the money and this five lakh is my",neg,0,22.6,90.97
23,"Suppose you are a thief and I will let you know it, but you will blackmail me on the other side and you get rid of all the clandestine cases with some money. We are now in the background, we are now with this leak. It will be resolved It does not seem to be that. If every parent says that my son would be honest, then it would not have happened. They do not want to talk about A + + education and education. And one thing is to say Exchange also definitely appreciate his desire to finish f nakarana abasai million over the quarter pichaneekata hand of a thief, kill desajanagana they are rich.",pos,1,22.6,90.94
23,5 lakhs of rupees will be given to Nahid Kakku on the behalf of the country.,neg,1,22.6,90.91
23,I think all the SSC examinees of the country should give a grant of Tk 20 lakh to the education minister and retire.,pos,1,22.6,90.88
23,"After this announcement the Education Minister has been demanding Ekushey Padak.
May Allah bless him with taufiq !!",neg,1,22.6,90.85
23,Why are mobile marketing companies available for women? Why do you have to pay? If so much money? For,pos,0,22.6,90.82
23,The questionnaire has now become a regular topic. For which education authority is responsible. The bad guys of the fruitful crop will start getting 5-10 years later.,neg,1,22.6,90.79
23,Best joke of the year.......,neg,1,22.6,90.76
23,"Who will pay their money to
Papa will give her a prize or a son or daughter. They are thieves
Here's what 500,000,000 rupees is worth if you pay 50000000000000.",pos,1,22.6,90.73
23,"On Era of Modern Technology, it's a very childish announcement.",neg,0,22.6,90.7
23,If the thief is looking for a thief then what thief will you catch? What is the feasibility offered by Chikamamanti ..,neg,1,22.6,90.67
23,"Maduruddin Nurul, who was able to show you the questions, who leaked the question.",pos,1,22.6,90.64
23,"To get rid of leaked question papers, take action - as in case of narcotics.",neg,1,22.6,90.61
23,"Do you know how to make Ganja Banaila?
Pulling the head in the tunnel
What's the way to do
Do you know how to make Ganja Banaila?
We do not have anybody to do, so we can do whatever we want",neg,1,22.6,90.58
23,"In the month of Chaitra, the main character of the autumn moon, Chaitra lost a cow and came home after searching the cows in Chaitra's house and said to his wife, 'Water drinks eat mother's food', standing next to her son's son clap, she said, what fun is fun ... Dad is calling my mother! The person who lost the cow then asked for the son: In the Chaita cow Harail, you are the brother of brother, brother!

Cancellation of examinations, 5 lac money prize inquiry committee, one can say these words when it comes to duty.",neg,0,22.6,90.55
23,"After some days, maybe it will be said, let us refrain from leaked question papers.",neg,1,22.6,90.52
23,Here the government is seeking help from the people in the place where the people will help the people. My gold bangladesh,neg,1,22.6,90.49
23,"Stop all these plays Bangladesh's administration is not so weak, the minister said.
General people and not so stupid, sir. You can destroy the militant dormitory by getting the news secretly.
Why not stop a little question?
The secret formula works only with the militants, all other corruption in the state, black clothes fall?",neg,1,22.6,90.46
23,Only solution crossfire.Its Destroyed our nation!!!,neg,1,22.6,90.43
23,All types of sexual practices should be exposed in the country. Coaching stopped untill the college closed on Friday. Khamkhialipana will destroy the country's future. The real culprits will be punished. Arrangements will be arranged. Then the question will be closed.,pos,1,22.6,90.4
23,"age education minister dora hok, onar kaj ki, ki kore fashoy, tini valo kore janen",neg,1,22.6,90.37
23,He should need to regain with take the liability & responsibility.,neg,1,22.6,90.34
23,"There is no comment, because if you talk more about the suspicion will come towards me. Hierarchy",neg,1,22.6,90.31
23,"The Education Minister himself is involved in the leak of questions, he is pushing the country towards destruction. They are cheating with the nation and students.",neg,1,22.6,90.28
23,"Loja is in the background. Apni bertho, to dayitto chere din, apnar sather lok jon e to prosno fas kore, apni dekhte pan na, tahole sadharon manus kemne dekhbe ???",neg,1,22.6,90.25
23,"Girl jara birup montobbo koreche tarai prosno faser sate jorito, eder dora houk,",neg,1,22.6,90.22
23,"All the people from the class One give you (#Kakku) A + with A +, so there will be no leak for the question, the life ministry is Nakan oil.",pos,1,22.6,90.19
23,jara prosno fas kore tara desher sotru. ader jabotjibon ba ba direct guli kore mara uchit.,neg,1,22.6,90.16
23,"The minister, you are the thief, you will be caught by someone else. People will catch you, and 5 lakhs will not work on that day ;,,,",neg,1,22.6,90.13
23,"Until good governance is confirmed, criminals can not get away from crime. Because I am the BPP my party is in power, again I make Awami League my party is in power, so all my crimes are not an offense, when this attitude works, they become more vulnerable to crime.",pos,1,22.6,90.1
23,"Once said that there is no leak, once again the five lakhs if the hand of the leaked! What kind of healthy people is this?",neg,1,22.6,90.07
23,"The more educated the nation is, the more advanced it is. And the more people who ask for higher education by leaking exams, what does the nation say?",neg,1,22.6,90.04
23,"If the question is leaked, then why do not you resign? He is keeping the appraisal tension apart from the tension of the testers, 30m will come before the center, otherwise do not give the test, if the question is leaked, the test will be canceled. Q Does everyone leak? Why should all the boys and girls be punished without taking them? Many may have many problems in the center, so if they do not come to the center of the exam can be examined. Now the question has been leaked or why he does not resign?",pos,1,22.6,90.01
23,"""Education is the backbone of the nation"", the education ministry should be the bearer of the spine and the minister is the head of his father
! If the father does not have the backbone, then no one knows how bright the future of the nation is. No one knows how this invertebrate is still alive in the chair. Can the Honorable Government not understand the factories of this factory?",neg,0,22.6,89.98
23,"What is the guarantee of money? Where the paper printed at less than 1 rupee and less can not be kept properly, there will be five lakh taka before it can be forgotten.",neg,1,22.6,89.95
23,"There is no desire to catch. Because the person who uploaded the question in the first nets and the person who shared the question, the arrests of the people will come out, the main mystery will come out.",pos,1,22.6,89.92
23,"The policing thieves were given up to Rs 5 lakhs by the policymaker. If you were to sell the case, you would not have to pay a comma.Joano ebobasata nawa hoise",neg,1,22.6,89.89
23,Nahid Kakku is the thief himself ... Five lakhs of rupees are given to him ... Chhala Beitla Harami ...,neg,1,22.6,89.86
23,"Nahid sings for Qasqar question.
The question of whether or not the child is being questioned after examining his child again",neg,1,22.6,89.83
23,"For the wife who is pursuing her, go to Herbal without spending money to catch the young man's neighbor. If the girl can not get out, she can not blame the boy.",pos,1,22.6,89.8
23,"Ajou and I have a lot of time ago. . Well, killing is far from being killed? What? What?",neg,1,22.6,89.77
23,"In Bangladesh culture, such a prize will not be able to catch the culprit, because it will have to suffer from the fact that the law will beat it.",neg,0,22.6,89.74
23,"And, karon doriye na diye o question paper sale kore 10 lakes earn korte, it's easy",pos,1,22.6,89.71
23,Wow! Finding such an offer on the day of money in the drought. You're ready for the Thai Thakkain. I'm saying ...,neg,1,22.6,89.68
23,I now dream of becoming a millionaire !! All the thieves will not be caught until the income! Ah !!,neg,1,22.6,89.65
23,"The vulnerable gloves need to be shatered on the public stage. Shala stadium still does not resign, and why do not we also do not represent the illegitimate people.",pos,0,22.6,89.62
23,The criminal is himself ... the prize money will be given to his father or will from his own pocket ... go to the top and save the nation. Do not play with the money of the nation.,pos,0,22.6,89.59
23,"By showing the roads, the nation can not be brought to the shadows of development, as long as the education system will not improve and the reduction will not reduce. I understand the government is silent?",neg,1,22.6,89.56
23,All the answers are with the Honorable Education Minister. What are the benefits of getting extra rewards to people?,pos,1,22.6,89.53
23,The minister must first be given to the police. As head of the department he is in line with this.,pos,1,22.6,89.5
23,"Who has the prerogative of the question paper, all of them can be known, what is the need to play.",neg,1,22.6,89.47
23,"If you do not give so much talbabana, you can only give the people of Jirilai jirilai, the minister, Mahatoya, your desire to shame,",neg,1,22.6,89.44
23,"How much does the software have to do with the new tacer channel, which is the best of the basin industry, so beparta rohossoi theke jabe?",pos,1,22.6,89.41
23,"If you want to know more about this book, then go to the teacher and ask the teacher if you are looking for an exemplary person, then you should try to find out if you have any questions about it, and then you can ask me to do any other work.",neg,1,22.6,89.38
23,Extraordinary concept Thieves Thought Models Manus Tech Kabaab Dhabay?,neg,1,22.6,89.35
23,Education Minster Private Jr. Amy Dariya Dilam 5 Luck; Awards Tea,neg,1,22.6,89.32
23,"Asked to be more conscious and honest with the people involved in making the question, the country will lose both the money and honor.",neg,1,22.6,89.29
23,"You have to wait for a few weeks ago. yes, what do you think of cash and deya hobe naki kind e? How to make a deyar system crazy?",neg,1,22.6,89.26
23,5 Lac Taka Kee Or Bapper Taka Naki ... Public of the era taka diia Prize to Dibe ... You about Podtag Corbi on .... Pislar Woe to the Pisces ...,neg,1,22.6,89.23
23,Now one of the involved is who will get involved. There will be two-and-half calculations?,neg,1,22.6,89.2
23,Yes..,neg,1,22.6,89.17
23,Party people have done this and the party's people are banned in the Awami constitution.,neg,1,22.6,89.14
23,"This news is for the whole nation, the education minister is outrageous",neg,1,22.6,89.11
23,"Who does the education minister resign? Surveys about this,",neg,1,22.6,89.08
23,"There is nothing other than Iwas, where her daughter's son-in-law is guilty",neg,1,22.6,89.05
23,"If you have to say it. Then it was okay
Come on, understand.",neg,1,22.6,89.02
23,The dust of the mustard that the ghosts in the rain!,neg,1,22.6,88.99
23,This is ridiculous !,neg,1,22.6,88.96
23,Thieves will be caught if the chicken puts mortgages to the fox? !!!,neg,1,22.6,88.93
23,Jokes of the year ??,neg,1,22.6,88.9
23,Soodesher Bhitore etc,neg,1,22.6,88.87
23,What is the thief?,neg,1,22.6,88.84
23,Want to know whether the voting results will be shown to the minister?,neg,1,22.6,88.81
23,The leaders of the leader of the elite linked to it have forgotten that I and thieves can steal all the ministers and thieves,pos,0,22.6,88.78
23,"5 lakh taka education minister will sell his father's wealth or not?
Want to know it before",neg,1,22.6,88.75
23,"The questions will be leaked.
But it will not be Bangladesh,
I think.",neg,1,22.6,88.72
23,"No! Because the people who are doing these, they are powerful activists!",pos,1,22.6,88.69
23,,,,22.6,88.66
23,,,,22.6,88.63
23,Try it. Any way. It does not work in one way or another.,neg,1,22.6,88.6
23,So Funny...!!,neg,1,22.6,88.57
23,There is no confidence in your own house,neg,1,22.6,88.54
23,"If it was the speculation that Nahid should resign, should not he?",neg,1,22.6,88.51
23,Announcing the prize itself for income?,neg,1,22.64,91.6
23,The person involved with the leaks will not offer 8-10 lakh rupees for the sake of not letting ????,neg,1,22.64,91.57
23,then you can download the podotag for free download,neg,1,22.64,91.54
23,The ghost in the moss,neg,1,22.64,91.51
23,When the champion is the spoiler the people are helpless.,neg,1,22.64,91.48
23,Prosno potro to fas hoyni 5 kÑ paben na,neg,1,22.64,91.45
23,"Nahid's son-in-law, Hameed H Sarkar",neg,1,22.64,91.42
23,He himself might have sold the question papers for millions of rupees,neg,1,22.64,91.39
23,Because he is a thief himself,neg,1,22.64,91.36
23,Must read! If Gulistan is around the shrine.,pos,1,22.64,91.33
23,Tukla's girl needs to see if she is involved. ??,pos,1,22.64,91.3
23,It would have been nice if there was another option to give 'hah' to the poll.,pos,1,22.64,91.27
23,Nothing except a farce,neg,1,22.64,91.24
23,5 lakh taka from his pocket? He does not have any problem to pay the public money.,pos,0,22.64,91.21
23,Sala pagol,neg,1,22.64,91.18
23,"He is alive and not ... Because he is a thief, he himself",pos,1,22.64,91.15
23,To whom will I give my questions?,pos,1,22.64,91.12
23,If Prothom Alo thinks that the criminals will be caught in the 5 million?,neg,1,22.64,91.09
23,This is the best jackpot of the year 2015,pos,1,22.64,91.06
23,Not 100%,neg,1,22.64,91.03
23,Anyone who can be caught will be trapped in the opposite case.,neg,1,22.64,91
23,Na Vaheer Chor Ki Sahje Dora Jai ??Boleen ..,neg,1,22.64,90.97
23,He is the thief who he is,neg,1,22.64,90.94
23,No haha ??reaicht with it.,neg,1,22.64,90.91
23,Five million will not work. Dump,neg,1,22.64,90.88
23,Nahid Kaku himself resigned as the only point of shame.,neg,1,22.64,90.85
23,"Nurul Islam Nahid, I get five lakh rupees",neg,1,22.64,90.82
23,"If the culprit is the announcer himself, then how can you?",neg,1,22.64,90.79
23,Do not catch,neg,1,22.64,90.76
23,"If there is ghost in the mustard seed, what will be there",neg,1,22.64,90.73
23,Five lakhs will be given to some? And the car will go from the pocket?,neg,1,22.64,90.7
23,No exam no leaks,neg,1,22.64,90.67
23,shikkha montri sob korcen vlo but jara prosna na pe nijer moto kre koste kre pore j exam dicce tader jonno keno i ne saste pawna jati ki kiku bol na cup kreu sojyo korbe,neg,1,22.64,90.64
23,"Brother does not let me hold
I'm leaked the question ..
Two people share 5 lakhs of rupees ...",neg,1,22.64,90.61
23,"Do not tell the voters of the thief, it will be all tick,",neg,1,22.64,90.58
23,There is no need to play outside in the house without a thief !!!!! Understand the people,neg,1,22.64,90.55
23,Thieves will never be caught in search of a thief throughout their lives.,neg,1,22.64,90.52
23,No,neg,1,22.64,90.49
23,No Ghost in the mustard. The rice was consumed by rice.,neg,1,22.64,90.46
23,"Dada jamma will not be caught. Because
The person who is making the announcement is himself a member.",neg,1,22.64,90.43
23,Dualityfinder,neg,1,22.64,90.4
23,She is involved in herself,neg,1,22.64,90.37
23,"If the man and the madman are crazy, by obstructing the rope or the rope crazy if you do?",neg,1,22.64,90.34
23,Yes,neg,1,22.64,90.31
23,Hat,neg,1,22.64,90.28
23,Scorching ghosts and now the mustard is entering into the ghosts.,neg,1,22.64,90.25
23,"No,",neg,1,22.64,90.22
23,"5 lakhs of rupees which will be removed, maybe he will be fishermen because the rules of our country is another type of work",neg,1,22.64,90.19
23,Nah,neg,1,22.64,90.16
23,"For those who give 5 lacs
And the one who gets him crossfire is okay",pos,1,22.64,90.13
23,"I know who the minister is the lord, the award is not Pamu !!",neg,1,22.64,90.1
23,Let's finally kill him,neg,1,22.64,90.07
23,No .... those who declare it are leaked .....,neg,1,22.64,90.04
23,No,neg,1,22.64,90.01
23,"Do not forget ,,,,",neg,1,22.64,89.98
23,"Like a father-in-law, father-in-law. Education is going on in the charity of 2 people.",neg,1,22.64,89.95
23,"Those who investigate, they are asking out. It is my belief
This is not the case at all",neg,1,22.64,89.92
23,"5 million donations!
The criminals will hand over to themselves ??",neg,1,22.64,89.89
23,Did any goat 'yes'? Let me know if you see this comment. See you a little,neg,1,22.64,89.86
23,"Does it take so much? Followed like Sunday movie, all will come out.",neg,1,22.64,89.83
23,Leaked the donor with 10 million rupees,neg,1,22.64,89.8
23,NONSENSE BELIEVE EVERYBODY IS NONSENSE !,neg,1,22.64,89.77
23,Here the minister of education was involved in myself and if I could get him caught.,neg,1,22.64,89.74
23,,,,22.64,89.71
23,,,,22.64,89.68
23,,,,22.64,89.65
23,No education has ever seen anybody in Bengal's history.,neg,1,22.64,89.62
23,There is no other way than his resignation,neg,1,22.64,89.59
23,"The 5lac prize on Diya, the dream was not the chare dile Valo hoy",neg,1,22.64,89.56
23,marunas fantasia,neg,1,22.64,89.53
23,"Than to comment, it feels more fun ...",neg,1,22.64,89.5
23,: People will be caught when they are aware.,pos,1,22.64,89.47
23,Because criminals will never be caught.,neg,1,22.64,89.44
23,Onno ksute jkn kaj hyni..so eta try krse..da jak ki hy ...,neg,1,22.64,89.41
23,"Do not mean to be caught ??

? mean that the criminal himself will be captured.",pos,0,22.64,89.38
23,It's an inconvenient question,neg,1,22.64,89.35
23,kno go vai desh ta jmn choltysy tmn cholty deo na ... posno fass holy karo ki tmn poblem asy ???,pos,1,22.64,89.32
23,Does he eat food? Where is the fatal idea comes from the head?,neg,1,22.64,89.29
23,I do not know,neg,1,22.64,89.26
23,The question leaked without the resignation of this minister will not stop.,neg,1,22.64,89.23
23,It's a question posed by the question itself,neg,1,22.64,89.2
23,It was said in another country. Want to hang the minister!,neg,1,22.64,89.17
23,You have to catch the shawl before,neg,1,22.64,89.14
23,The question of how much money is worth 5 lakhs.,pos,1,22.64,89.11
23,Then the education minister's son Imran H Sarker was arrested.,neg,1,22.64,89.08
23,How can I get education minister?,neg,1,22.64,89.05
23,kaku may b pagol hoye gese,neg,1,22.64,89.02
23,The pagol hole dore becomes r ... ultra-kore fasai ........ je vekub se korbe .......,pos,0,22.64,88.99
23,No ..... all is not in the money,neg,1,22.64,88.96
23,"I want to hand over the Education Minister to the question leaks,",neg,1,22.64,88.93
23,The darkness behind the lamp ??,neg,1,22.64,88.9
23,The criminals will be alert. Because Raghav Boal is involved with them. Other ways will follow.,pos,0,22.64,88.87
23,The result of such a vote will not take time to stop this polling.,neg,1,22.64,88.84
23,"Leaked the question, but in tolerable levels! : D",neg,1,22.64,88.81
