NewsId,Comment,Sen,Con,lat,long
555,"Humayun is to say like Aham. He said: to give honesty, honesty and belief words to rise from the Bangla dictionary. I will say in Bangladesh, I will say in Bangladesh. I am going to continue, I will continue. We will not be able to broach without any hesitation.",pos,1,24.24,89.95
555,"Education Minister will be remanded with a high-ranking official, including Education Secretary. Then Assol can be captured.",pos,1,24.24,89.92
555,Without giving punishment to responsible criminal it is useless to identify who is responsible ?,neg,1,24.24,89.89
555,"Who's there, but I'm guru. Khayni /
The cat's neck. Hours K /
Interesting in Bangladesh is possible /",neg,1,24.24,89.86
555,Where our Honorable Education Minister said the question is no. What will we say if you give opinion? Falcitation is being done with the public,pos,1,24.24,89.83
555,"Finance Minister Mall Muhith, who had said that he had no match with the question papers, then what are the prizes announced now?",neg,1,24.24,89.8
555,The only way is to get the army from the arm or board to the center directly to reach the center in my opinion ??????????,neg,1,24.24,89.77
555,The country was filled with admiration and gave a proof to him that the minister of the child's education minister could talk about his defection ....,neg,1,24.24,89.74
555,"The question should be asked by the Education Minister that the question will be rewarded if it can not be misleading, but to make mistakes in education policy.",neg,1,24.24,89.71
555,"As long as there will be a change in the low mindedness of questions, the questions will be leaked. Need mentality change before",neg,1,24.24,89.68
556,A nonsensical statement of mockery! Shows off how vulnerable the education system is!,neg,0,24.24,89.65
556,Proshno Fashkarii chohon proshasoner vitor thake tokhon eii 5 lakh takao proshasoner vitor e thakbe ........ dhoraii dewar kisuii naii,neg,1,24.24,89.62
557,"A small prediction: If this is real, then the government has to beg for giving a reward",pos,1,24.24,89.59
557,You resign from the Cabinet Council in Bangladesh. Then there is the possibility of a sin.,neg,1,24.24,89.56
557,People do not have to do anything. Because when the government says what are we for? We will do everything. His example is the government giving a skeleton race to leak the question.,neg,1,24.24,89.53
557,"What is being done to stop the question leaked is nothing but laughing. It turned out to be such that ""my wife stopped afar and closed the shop of the conductor without saying anything to her"" """"",neg,1,24.24,89.5
559,It is never possible with the two big political parties in Bangladesh that are in politics because they are so bad politics that they can not do anything good with them. It is necessary to create a new party for the development of the country.,neg,1,24.24,89.47
561,"The leaked questioner has to be employed, with the seizure of all assets including tab bank accounts.",neg,1,24.24,89.44
562,"Leave everything, the education minister should resign.
Will not leave the office of power",neg,1,24.24,89.41
562,vai ....... 3 3,neg,1,24.24,89.38
562,Ami akjon ssc candidate hoye ....shikkhamontrir kase onurodh korsi j ....just 1 month all social media  off rakhle amader jonno better hoto......bcz amra to atota suffer korte parbona.....xm cancel korar por...next xm a j ques out hobe na ..er ki kono gauranty ache??????,neg,1,24.24,89.35
562,"The education minister said the questionnaire will be re-examined, did he forget it now? Oh yes, he's still saying the question has not exploded. He is a strange cabinet minister",pos,1,24.24,89.32
562,"Any account that opens, the number of biometric registrations. If the government wishes, there is no problem to catch them. The main point is to raise the rate next, the country is moving forward into the water of the forest.",neg,1,24.24,89.29
562,The militants became more terrorists than I did,neg,1,24.24,89.26
562,"If there is ghost in the mice, then it will happen.",neg,1,24.24,89.23
562,The employees of their own department do not want to steal again by stealing the reward.,neg,1,24.24,89.2
562,"Police are running behind the BNP
The question is where is the time behind the leaked man",neg,1,24.24,89.17
562,"If he is involved with his son-in-law, what will he say to our kakku ??",neg,1,24.24,89.14
562,Facebook has to be closed for 1 to 20 minutes before the last night of the test from 9am to the next.,neg,1,24.24,89.11
562,,,,24.24,89.08
562,"According to him, there is no question in the country, why the reward came?",neg,1,24.24,89.05
562,It is not possible to stop rats in the house. Minister resigns,pos,0,24.24,89.02
562,Nahid Kaku is a hypocrite. It was proven after the disruption of the question,neg,1,24.24,88.99
562,The failed minister should have the shame that what could not be done or what resign?,neg,1,24.24,88.96
562,Hold the minister!,neg,1,24.24,88.93
562,"If there is a ghost in moss, then there is no benefit from declaring these rewards ...",neg,1,24.24,88.9
562,It's Bad News For Us.,neg,1,24.24,88.87
562,"If I take only two to three methods, I think it is 100% possible to stop question papers",neg,1,24.24,88.84
562,It's Bad News For Us.,neg,1,24.24,88.81
562,"If someone gets a copy please, please please do me also",neg,1,24.24,88.78
562,Before the Tackle Minister will have to catch the thief,neg,1,24.24,88.75
562,The test should be taken again,neg,1,24.24,88.72
562,Nahid will be remanded in Kakkur if all is ____,neg,1,24.24,88.69
562,If you wear pearl necklace in the neck of the cat ...,neg,0,24.24,88.66
562,Online prosno protidin 9 tai dile.rodh kora somvob.ja pint Korean porikha dibe,neg,1,24.24,88.63
562,"If you are a citizen of the thief, then you are the people. Why are you wearing a chair ????",neg,1,24.24,88.6
562,The only claimant education minister of this award is the Minister of Education.,neg,1,24.24,88.57
562,Mega katan r koto ni koto. . . . .,neg,1,24.24,88.54
562,Mr. Minister is the share of the money is water,neg,1,24.24,88.51
562,He announced the money that he himself was involved in this work.,neg,1,24.28,91.6
562,The award should be given to him that the minister will be excluded.,neg,1,24.28,91.57
562,Nahid's brother will be caught,neg,1,24.28,91.54
562,I see some brokers come with brother liv,neg,1,24.28,91.51
562,"First of all, who has to be educated by the Education Minister.",neg,1,24.28,91.48
562,What is the administration of the country?,neg,1,24.28,91.45
562,Thief's mother's big throat,neg,1,24.28,91.42
562,Where can I give all my pain medicines?,pos,1,24.28,91.39
562,Hold down the house beforehand,neg,1,24.28,91.36
562,There is no question of proper investigation.,pos,1,24.28,91.33
562,"Dhayon Mia, where the massacre and the son-in-law,",neg,1,24.28,91.3
562,"Those who have been asked about them, they have leaked the question 100%",neg,1,24.28,91.27
562,Ghost in the mustard,neg,1,24.28,91.24
562,The test is canceled and needs to be examined again,neg,1,24.28,91.21
562,hum,neg,1,24.28,91.18
562,good,pos,1,24.28,91.15
562,"s, sc exams like Jodbah to fight Zahra questions, and their war criminals should be tried",pos,1,24.28,91.12
562,only i wash......,neg,1,24.28,91.09
562,There is no need to take a test. Then the question will not be leaked. How many ............,neg,1,24.28,91.06
562,"As the country becomes digital, the question will be leaked in the digital system",neg,0,24.28,91.03
562,even want to ask. loge amio asi.,neg,1,24.28,91
562,Identify the irresponsibility of irresponsible responsibility,neg,1,24.28,90.97
562,The education minister should resign,neg,1,24.28,90.94
562,The questions leak are common people,neg,1,24.28,90.91
562,"Po s' s fairytale. . Hello, I'm sorry.",neg,1,24.28,90.88
562,Revoke the test again to be examined,neg,1,24.28,90.85
562,lok k bolcen kno...nijerai dhorun na,neg,1,24.28,90.82
562,"From now on, I do not ... I do not study",neg,1,24.28,90.79
562,"Thieves steal in the house ....
ˇMd Ashraful Islam",neg,1,24.28,90.76
562,"Basically, that person has understood that it is permissible to steal knowledge. So they will steal knowledge. To stop this, some intellectuals have to be killed. Because a rotten potato gets rid of potatoes in whole cold stomach. Therefore, it is necessary to throw out the rotten potato.",neg,1,24.28,90.73
562,Tinker ring,neg,1,24.28,90.7
562,"To stop the question leak, the Education Minister will have to send the questions to the school-college email number, half an hour before leaving the questions, if the questions are being asked, then the question can be closed.",neg,1,24.28,90.67
562,https://www.facebook.com/groups/1427655277561516?view=info&refid=18&ref=dbl Some links of questioning groups. Can see.,neg,1,24.28,90.64
562,http://www.somoynews.tv/pages/details/101149 SSC question leaks: committee formed to decide on cancellation of Bangla test somoynews.tv,neg,1,24.28,90.61
562,,,,24.28,90.58
562,,,,24.28,90.55
562,,,,24.28,90.52
562,,,,24.28,90.49
562,,,,24.28,90.46
562,,,,24.28,90.43
562,,,,24.28,90.4
562,,,,24.28,90.37
562,"Oh Ray Selectors ** Such teams will be selected before the fielding of the superintendent's crew will be full ** Why Rubel and Shafiul will not be able to sit on the toilet and where to play ** Where and if the rest of Muttafiz is in the hands of himself ** Resting him, Shraddo Will not be your ** and Liton, who will keep Tushar Imran in the team if the sky will be broken to the head ** Shala Abal Marka selector .. Then Sohag Gazi playing bad ** as the crazy",neg,0,24.28,90.34
562,"During the fielding quota and batting, Sir Sabbir Rahman has been called for a lot of face and feet.",neg,1,24.28,90.31
562,"My favorite eleven
Tamim, Imrul, Mominul, Mushfiq,
Mosaddek, Riyadh, Sabbir, Miraj,
Taizul, Razzak, Rubel .. (If not playing Shakib.)",pos,1,24.28,90.28
562,"hahaha ....
In the episode match, the squad was dropped !! Hierarchy
bad luck sanjamul",neg,1,24.28,90.25
562,"Amr kache best test 15hocche

Tamim, Nafees, Imrul, Musfiq, Mominul, Nasir, Mahmudulla, Rubel, Mustafiz, Miraz, Taizul, Razzak, Liton, Shafiul Taskin test er jonno vlo hobe",pos,1,24.28,90.22
562,"My favorite Element ?
Tamim, Imrul, Mominul, Mushfiq,
Liton, Riyadh, Sabbir, Miraj,
Taizul, Razzak, Mostafiz",pos,1,24.28,90.19
562,"Alar selector ,,,,,,,,,,, There is no intelligence to choose the team even after playing in the country.",neg,1,24.28,90.16
562,Ghosh seems to have entered the team.,neg,1,24.28,90.13
562,What is the use of Shabbir?,neg,1,24.28,90.1
562,"Whether Sabbir knows the test game or not, I know he is a T20 player",neg,1,24.28,90.07
562,"Guess, Sabbir will be in the next match.",neg,1,24.28,90.04
562,What is the party for Sabbir? Do not understand what the selectors have a good team.,pos,1,24.28,90.01
562,Abel's team excludes Rubel in formula ??????,neg,1,24.28,89.98
562,But the chair of Salar Piotr R .. Siber a small but narrow Nile,neg,0,24.28,89.95
562,Sabbir is coming to the team with money from Papon.,neg,1,24.28,89.92
562,Shabbir as a hero?,neg,1,24.28,89.89
562,Bailey Selective Board,neg,1,24.28,89.86
562,Rubel Bad Kanu?,neg,1,24.28,89.83
562,Need of market monitoring of daily products,pos,1,24.28,89.8
562,"Two are dropped ..!
One got a call ..!
how..?",neg,1,24.28,89.77
562,Rubel cara dole baabe sompurno hoy,neg,1,24.28,89.74
562,Nasir Hossain would have been taken in the Test. And Abdul Razzaq should have been brought back to the team.,neg,1,24.28,89.71
562,,,,24.28,89.68
562,"What has been done with S. K. Sunha,
Then any other judgment will not work independently or with courage!
The nation is so shocked!",neg,1,24.28,89.65
562,"The status of the post of Chief Justice and its widespread absence is nowhere. The Department of Justice is not at all comfortable, Haseena Sarkar's abduction of power of the Bachacharya !!!",pos,1,24.28,89.62
562,"Present Justice Awamileague Surendra Sinha has given the correct verdict, so he resigns",pos,1,24.28,89.59
562,"Without the spell of Hasina, the right judiciary started shouting. Mahabub said to be a liar, he would not be able to speak out. Tell a little more truth and tell lies. Your life seems to have not said a truth yet.",pos,1,24.28,89.56
562,"Because of Khaled Muhidin, we see today's Bangladesh program. His voice in linguistic style",neg,1,24.28,89.53
562,,,,24.28,89.5
562,"Sir, you are not paid to spend our hard earned money like this ....
You are unable to fulfill your duties, you should promise, ..., you will not get any salary and salary unless you catch the culprits ...... Yourself a little hard, and, in the AC room, stop talking big things, right to your responsibility Celebrates .....",neg,1,24.28,89.47
562,"We are sorry to say, you are completely fail to control your ministry. So, Mr. Minister, you and along with all board chairman should Regine.",neg,1,24.28,89.44
562,"Many unscrupulous persons posted on Facebook, asking questions related to employment from primaries to job inquiries. There are many groups and pages on Facebook for questions. 100% guarantees the common, and if you do not recite, you can guarantee the return of the money.
In the past, many people have been arrested for making bad comments to the nation's father, the prime minister and the politicians, under the law.
The extent of the culprit, it is not beyond the scope, it is proved by the present government repeatedly.

So, who are facing questions on Facebook, who are being questioned without fear? If you give them an egg therapy with remand, then you will know where the question comes from.
But the Minister of Education has repeatedly hiding with the people about the issue.
Why this hidden game?
To scare away the worms, fear of going out of the snake !!",neg,1,24.28,89.41
562,"Well, the opportunity to earn 5 million taka by purchasing question papers at 2 lakh rupees !!",neg,1,24.28,89.38
562,"Corruption can not be sunk by showing the money in the heat. From the police, the police, the police, the question is to eliminate the passersby, as if they were sitting on the streets like the Nagini snake or not. If the fake copy is stopped, then the government's lack of money? Closed all projects across the country. If there is a lack of money, then stop the fictitious trade.",neg,1,24.28,89.35
562,Reward announce korse... !!! Dekhsen amader education minister koto capable!! Nijer pocket theke 5lac taka dibe bolse!! Onno kono deshe dibe nijer pocket theke kew taka?? Boro jor resign korto.. But amader education minister dekhen....!!,pos,1,24.28,89.32
562,"Mr.Shamless Minister, you are failure. You should resign.  please don't waste time and destroy the educational environment and backbone of a nation.",pos,0,24.28,89.29
562,"Earlier it was said that ""if question papers fall, cancel examinations"" is what is said in hupp?",neg,1,24.28,89.26
562,Is that kind of joke? I have no clue why they are playing with our education system! He should admit the fact and resign.,neg,1,24.28,89.23
562,"You can not catch what you do in the ministry. The thief is inside of you, if you can not, resign, please put Ehsanul Haque Milon Sahib. If you can not do this, then you go and meet Mr. Milon. # Education Minister #",neg,1,24.28,89.2
562,"If you can not be a minister of education, if you can not do the question, then what is your job? Then resigns.",neg,1,24.28,89.17
562,"In these circumstances you should resign. Since a key question is in the trap and you are not able to control it. Therefore, protect your respect by resigning",pos,1,24.28,89.14
562,"The question will be passed on you from the cemetery, from the tile to the tine,",neg,1,24.28,89.11
562,"Education Minister, you go straight to the police station and say I am involved in the questionnaire, then I will appeal to the chief minister, give me five lakh rupees.",pos,1,24.28,89.08
562,"Nobody thinks the value of your words is worth four pounds! Teacher society can not see you, again minister!",pos,1,24.28,89.05
563,"The parents of the students of Bangladesh are saying that you have spent so much money and needing to study how many coaching centers do not waste thousands of rupees in the exams, and the parents of the parents will be saved. And why the minister of the education minister of Koolangar still did not resign, he encouraged himself to be corrupted.",neg,1,24.28,89.02
563,"A few minutes ago I saw a news that I was delayed in Parliament for one minute, a British minister submitted the resignation letter ... for several years, the question is being asked, will you still be able to answer?",neg,0,24.28,88.99
563,"If Nihad is brought under the remand of Nahin, then it is not possible to stop the question papers, but Nahid himself is asking for justice by spreading the question papers in exchange for money. Imran H Sarkar, but he is living a lot of luxurious life. ?? Again, write any other topic to Facebook but do not write anything about the question papers, I think that he and the question papers involved in Fasan should be brought to justice.",neg,0,24.28,88.96
563,"The question paper is leaked by the people of Patna. What should be done if only others blame it? Next, find out the people of the education department. Find them and put them on the verge of punishment ... Then others blame them.",neg,1,24.28,88.93
563,"The names of village coaching are payable only for money; Students of renowned high school coaching can spend more money to wear private but in poor rural coaching, poor students will later lag behind. In the case of fishermen, the harsh punishment of some of the greedy teacher teachers of Kenn And the center of the union should be given more attention",neg,1,24.28,88.9
563,"You and your friend are with Salar's spindle. If I could get Salma Madari Toure, then what did I mean? Do not you have examined me, how do you know how difficult it is to suffer",neg,1,24.28,88.87
563,Poor hawa bindo kor kamkari baba ... 5 bribe that Torbar babar taka db ???,neg,1,24.28,88.84
563,"You know the story of Kaushara, a son of your house, and you know it well. One person remembers a story in a restaurant, and one person can eat a lot of good food after eating. His bill is two thousand rupees after eating and he has two hundred rupees. He went to the cache and said, ""I do not have any money."" The manager was angry and heard the police and handed him over to the police. Then the man gave the police a hundred rupees. Got out",neg,1,24.28,88.81
563,"Questioning the people of the whole country is involved with the leak? From the printing to the center, how many people are there to keep watch?",neg,1,24.28,88.78
563,"Often millions of unemployed children in this country become sinners, and if he performs the promise",pos,1,24.28,88.75
563,Which is introduced in Bangladesh ... it does not stop ... It is going on in some forest ...,neg,1,24.28,88.72
563,"It seems to be closed this time. The rails of Bengal will certainly get rid of the money. However, the money will be genuine example.",pos,1,24.28,88.69
563,"Kaku, if you will retire. Give the responsibility of the thieves to the people, what do you need?",neg,1,24.28,88.66
563,Oo amra kosto kore exam dibo ar onno ra bosha bosha A +! .. valo tho ... apr exam hok abr dibo n.p..but ai onnay valo na,neg,1,24.28,88.63
563,"Do not say such a laugh. Is there anything that the government can not do? The government and the people of the government need the good will, which they do not have. Because the children of the people of that level write on the outside country, they do not have any headaches, their headache, how they will earn money, and write off their children wearing outside state",neg,1,24.28,88.6
563,"Examination takes 30 minutes to answer how the question is out. How to enter the student at 10 o'clock, this is the main problem.",neg,0,24.28,88.57
563,Good plant I will get one hundred and five lakh rupees by paying one hundred and one lakh rupees by redemption. How much is left?,neg,1,24.28,88.54
563,"Normal people will get rid of those who do these tasks, the government will have to take strict measures",neg,1,24.28,88.51
563,"Do what you do in the Information Technology era Fb and turn them into questions. And if you steal, you will catch it",neg,1,24.32,91.6
563,Bangladesh's ministers will be in power even when the world overturns. They will not be caught in their failure.,neg,1,24.32,91.57
563,"Hey Mia gave Moksha alms to Fakir, and said to you, what five lakh Maa said what the soil said. Take away the liability during the trial of what has happened before
Do you feel ashamed or gone?",pos,1,24.32,91.54
563,"Tukla Kaku, the nation wants to know where you will get these five lakhs from where? From the government fund or from your funded funds?
If you have to pay government money, you do not need to because you want us to be Hiru or Takla Kaku with our money?",neg,1,24.32,91.51
563,"I can give it!
It's absolutely straightforward!
You And the BCL has been dealing with this!
But get the reward?",pos,1,24.32,91.48
564,"What will happen if the question is not asked. If the test was conducted then the test of 1972 was taken. The teachers who are in charge of the hall, have asked me to write the question of student students. So how will the future generations improve. The teachers run 100% pass. And more than the plus. What will happen then by examining it, and by stopping the questioning ????",neg,1,24.32,91.45
564,"The question will cost millions of rupees, and if you spend five lakhs from there, what do you want to do? What is the league said that he will not give his life?",pos,1,24.32,91.42
564,"The people with whom they are making questions, who are giving questions to them, take them on remand, will get all the information, waste the government money, and if they do not, then please give up the responsibility.",pos,1,24.32,91.39
564,"Eupour gorto thke bang, all of the snake bahir kora jay but aet jonnoo poruskar ....
vah moja pailam boss ...",neg,1,24.32,91.36
564,Money left your father and left. Who said big money with money? People's cost money,neg,1,24.32,91.33
564,"It's never possible. Budge ...
The person who made this announcement is the head of the questionnaire. Psychology proves that ...",pos,0,24.32,91.3
565,"So, the public will catch the criminals while public servants carry on taking bribes at 'tolerable' levels?",pos,0,24.32,91.27
565,"Those who are highly involved with creating and printing question papers are excluded from the job and remanded, only then will the thieves come out hopefully.",neg,1,24.32,91.24
565,"Only five lakhs. Therefore, the salar abal bangali On this side, Salar is making millions of money and he has five lakhs ...",neg,1,24.32,91.21
565,Approperty Moto MotoColorComocortara Ja Dornititi Courtesy Dodar of Door Zonno?,neg,1,24.32,91.18
565,"If the education minister does not resign, it will not be resolved. Because the government is not sincere. Where the question papers are announced on Facebook, it is possible to get caught through technology.",neg,0,24.32,91.15
565,"If the resignation of liability, then the image of the party will increase. The people wanting to do so. It is a good opportunity for the team.",neg,0,24.32,91.12
565,"The straightforward minister will all be right if you give up. You move to the AC room and move in the AC car. And the students of the village examined the cold winter time. Many of those tests asked to be canceled. But those who tested the money that money would give you the minister. If your party's people have not fired question papers, why do not you catch them? Stop game too much.",pos,0,24.32,91.09
565,What is the profit by rewarding? Find out better than it will come out from above itself.,pos,1,24.32,91.06
565,"The people understand, know - he is not anybody, the Minister of Education is himself, he picks up the question of eating the money, and plays in front of the media. The minister said, do not play the money, how will it be? And the bank balance or how to increase day by day. Line",neg,0,24.32,91.03
565,"Kakku, you're failing to stop the question leak! Why so silly say so!",neg,1,24.32,91
565,5 lakhs of taka after arresting the accused What is his mother? Soccer failed question holder or they are stronger than soccer .... !!,neg,1,24.32,90.97
565,"You will leak, you will get reward,
What Circus Ray ......!
A ridiculous helpless minister,",neg,1,24.32,90.94
565,"You yourself have question papers. Doing one thing yourself, surrender yourself to the police and take 5 lakhs of money yourself",neg,1,24.32,90.91
565,"The question papers will be leaked and you are saying that, this, the business, started, business, started.",neg,1,24.32,90.88
565,"How are you still tired? If you are a little shy, you should resign. Why should you take the responsibility that you are not able to wear a jetty repeatedly. The Prime Minister should expel him from this position.",neg,1,24.32,90.85
565,Everyone has the fear that thieves will not be able to catch thieves. So there is no profit to help the people in your failure.,pos,1,24.32,90.82
565,"It does not agree with the words of Abal, like this, the words of a minister, do not obey the words of this ablative, they are the ones who make the same mistake, they are the ones who say, the great, the person who gives them, they will be arrested and imprisoned. ,,,,, this is the principle of the Abal Party",neg,1,24.32,90.79
565,"Rather, it should be said not to say that if the mistake of education policy is wrong, it will be rewarded 5 lakhs.",neg,1,24.32,90.76
565,"If you do not have any reason to steal the curtain, then there is nothing to do. Those who are in the custody of themselves, they are going to question themselves, all will come out on their behalf.",neg,1,24.32,90.73
